,TEXT
3927,she dwelt here by the pool with its landing-stairs in ruins. many
3928,an evening she had watched the moon made dizzy by the shaking of
3929,"bamboo leaves, and on many a rainy day the smell of the wet earth"
3930,had come to her over the young shoots of rice.
3931,her pet name is known here among those date-palm groves and
3932,in the courtyards where girls sit and talk while stitching their
3933,winter quilts. the water in this pool keeps in its depth the memory
3934,"of her swimming limbs, and her wet feet had left their marks, day"
3935,"after day, on the footpath leading to the village."
3936,the women who come to-day with their vessels to the water have
3937,"all seen her smile over simple jests, and the old peasant, taking"
3938,"his bullocks to their bath, used to stop at her door every day to"
3939,many a sailing-boat passes by this village; many a traveller
3940,takes rest beneath that banyan tree; the ferry-boat crosses to
3941,yonder ford carrying crowds to the market; but they never notice
3942,"this spot by the village road, near the pool with its ruined"
3943,"landing-stairs,-where dwelt she whom i love."
3944,lover's gifts xviii: your days 
3945,"your days will be full of cares, if you must give me your heart."
3946,my house by the cross-roads has its doors open and my mind is
3947,"absent, -for i sing."
3948,"i shall never be made to answer for it, if you must give me"
3949,"your heart. if i pledge my word to you in tunes now, and am too"
3950,"much in earnest to keep it when music is silent, you must forgive"
3951,me; for the law laid down in may is best broken in december.
3952,"do not always keep remembering it, if you must give me your"
3953,"heart. when your eyes sing with love, and your voice ripples with"
3954,"laughter, my answers to your questions will be wild, and not"
3955,"miserly accurate in facts, -they are to be believed for ever and"
3956,then forgotten for good.
3957,lover's gifts xxii: i shall gladly suffer 
3958,"i shall gladly suffer the pride of culture to die out in my house,"
3959,if only in some happy future i am born a herd-boy in the brinda
3960,the herd-boy who grazes his cattle sitting under the banyan
3961,"tree, and idly weaves gunja flowers into garlands, who loves to"
3962,splash and plunge in the jamuna's cool deep stream.
3963,"he calls his companions to wake up when morning dawns, and all"
3964,"the houses in the lane hum with the sound of the churn, clouds of"
3965,"dust are raised by the cattle, the maidens come out in the"
3966,courtyard to milk the king.
3967,"as the shadows deepen under the tomal trees, and the dusk"
3968,"gathers on the river-banks; when the milkmaids, while crossing the"
3969,"turbulent water, tremble with fear; and loud peacocks, with tails"
3970,"outspread, dance in the forest, he watchers the summer clouds."
3971,"when the april night is sweet as a fresh-blown flower, he"
3972,disappears in the forest with a peacock's plume in his hair; the
3973,swing ropes are twined with flowers on the branches; the south wind
3974,"throbs with music, and the merry shepherd boys crowd on the banks"
3975,of the blue river.
3976,"no, i will never be the leader, brothers, of this new age of"
3977,new bengal; i shall not trouble to light the lamp of culture for
3978,"the benighted. if only i could be born, under the shady asoka"
3979,"groves, in some village of brinda, where milk is churned by the"
3980,lover's gifts xxviii: i dreamt 
3981,"i dreamt that she sat by my head, tenderly ruffling my hair with"
3982,"her fingers, playing the melody of her touch. i looked at her face"
3983,"and struggled with my tears, till the agony of unspoken words burst"
3984,my sleep like a bubble.
3985,"i sat up and saw the glow of the milky way above my window,"
3986,"like a world of silence on fire, and i wondered if at this moment"
3987,she had a dream that rhymed with mine.
3988,lover's gifts xxxix: there is a looker-on 
3989,"things in ages and worlds beyond memory's shore, and those"
3990,forgotten sights glisten on the grass and shiver on the leaves. he
3991,"has seen under new veils the face of the one beloved, in twilight"
3992,hours of many a nameless star. therefore his sky seems to ache with
3993,"the pain of countless meetings and partings, and a longing pervades"
3994,"this spring breeze, -the longing that is full of the whisper of"
3995,ages without beginning.
3996,"that i should make much of myself and turn it on all sides, "
3997,thus casting colored shadows on thy radiance 
3998,---such is thy maya. 
3999,thou settest a barrier in thine own being 
4000,and then callest thy severed self in myriad notes. 
4001,this thy self-separation has taken body in me. 
4002,the poignant song is echoed through all the sky in many-coloued tears 
4003,"and smiles, alarms and hopes; waves rise up and sink again, "
4004,dreams break and form. 
4005,in me is thy own defeat of self. 
4006,this screen that thou hast raised is painted with innumerable figures 
4007,with the brush of the night and the day. 
4008,"behind it thy seat is woven in wondrous mysteries of curves, "
4009,casting away all barren lines of straightness. 
4010,the great pageant of thee and me has overspread the sky. 
4011,"with the tune of thee and me all the air is vibrant, "
4012,and all ages pass with the hiding and seeking of thee and me.
4013,moment's indulgence 
4014,i ask for a moment's indulgence to sit by thy side. the works 
4015,that i have in hand i will finish afterwards. 
4016,"away from the sight of thy face my heart knows no rest nor respite, "
4017,and my work becomes an endless toil in a shoreless sea of toil. 
4018,today the summer has come at my window with its sighs and murmurs; and
4019,the bees are plying their minstrelsy at the court of the flowering grove. 
4020,"now it is time to sit quite, face to face with thee, and to sing "
4021,dedication of life in this silent and overflowing leisure
4022,my friend 
4023,art thou abroad on this stormy night 
4024,"on thy journey of love, my friend? "
4025,the sky groans like one in despair. 
4026,i have no sleep tonight. 
4027,ever and again i open my door and look out on 
4028,"the darkness, my friend! "
4029,i can see nothing before me. 
4030,i wonder where lies thy path! 
4031,"by what dim shore of the ink-black river, "
4032,"by what far edge of the frowning forest, "
4033,through what mazy depth of gloom art thou threading 
4034,"thy course to come to me, my friend?"
4035,my song 
4036,"this song of mine will wind its music around you, my child, like"
4037,the fond arms of love.
4038,this song of mine will touch your forehead like a kiss of
4039,when you are alone it will sit by your side and whisper in
4040,"your ear, when you are in the crowd it will fence you about with"
4041,"my song will be like a pair of wings to your dreams, it will"
4042,transport your heart to the verge of the unknown.
4043,it will be like the faithful star overhead when dark night is
4044,over your road.
4045,"my song will sit in the pupils of your eyes, and will carry"
4046,your sight into the heart of things.
4047,"and when my voice is silent in death, my song will speak in"
4048,your living heart.
4049,o fool 
4050,"o fool, try to carry thyself upon thy own shoulders! "
4051,"o beggar, to come beg at thy own door! "
4052,"leave all thy burdens on his hands who can bear all, "
4053,and never look behind in regret. 
4054,thy desire at once puts out the light from the lamp it touches with its breath.
4055,it is unholy---take not thy gifts through its unclean hands. 
4056,accept only what is offered by sacred love.
4057,ocean of forms 
4058,"i dive down into the depth of the ocean of forms, "
4059,hoping to gain the perfect pearl of the formless. 
4060,no more sailing from harbor to harbor with this my weather-beaten boat. 
4061,the days are long passed when my sport was to be tossed on waves. 
4062,and now i am eager to die into the deathless. 
4063,into the audience hall by the fathomless abyss 
4064,where swells up the music of toneless strings 
4065,i shall take this harp of my life. 
4066,"i shall tune it to the notes of forever, "
4067,"and when it has sobbed out its last utterance, "
4068,lay down my silent harp at the feet of the silent.
4069,old and new 
4070,thou hast made me known to friends whom i knew not. 
4071,thou hast given me seats in homes not my own. 
4072,thou hast brought the distant near and made a brother of the stranger. 
4073,i am uneasy at heart when i have to leave my accustomed shelter; 
4074,"i forget that there abides the old in the new, "
4075,and that there also thou abidest. 
4076,"through birth and death, in this world or in others, "
4077,"wherever thou leadest me it is thou, the same, "
4078,the one companion of my endless life 
4079,who ever linkest my heart with bonds of joy to the unfamiliar. 
4080,"when one knows thee, then alien there is none, then no door is shut. "
4081,"oh, grant me my prayer that i may never lose "
4082,the bliss of the touch of the one 
4083,in the play of many.
4084,on the seashore 
4085,on the seashore of endless worlds children meet. 
4086,the infinite sky is motionless overhead and the restless water is boisterous. on the seashore of endless worlds the children meet with shouts and dances. 
4087,"they build their houses with sand, and they play with empty shells. with withered leaves they weave their boats and smilingly float them on the vast deep. children have their play on the seashore of worlds. "
4088,"they know not how to swim, they know not how to cast nets. pearl-fishers dive for pearls, merchants sail in their ships, while children gather pebbles and scatter them again. they seek not for hidden treasures, they know not how to cast nets. "
4089,"the sea surges up with laughter, and pale gleams the smile of the sea-beach. death-dealing waves sing meaningless ballads to the children, even like a mother while rocking her baby's cradle. the sea plays with children, and pale gleams the smile of the sea-beach. "
4090,"on the seashore of endless worlds children meet. tempest roams in the pathless sky, ships are wrecked in the trackless water, death is abroad and children play. on the seashore of endless worlds is the great meeting of children."
4091,only thee 
4092,"that i want thee, only thee---let my heart repeat without end. "
4093,"all desires that distract me, day and night, "
4094,are false and empty to the core. 
4095,"as the night keeps hidden in its gloom the petition for light, "
4096,even thus in the depth of my unconsciousness rings the cry 
4097,"---`i want thee, only thee'. "
4098,as the storm still seeks its end in peace 
4099,"when it strikes against peace with all its might, "
4100,even thus my rebellion strikes against thy love 
4101,and still its cry is 
4102,"---`i want thee, only thee'."
4103,paper boats 
4104,day by day i float my paper boats one by one down the running
4105,in bid black letters i write my name on them and the name of
4106,the village where i live.
4107,i hope that someone in some strange land will find them and
4108,know who i am.
4109,"i load my little boats with shiuli flower from our garden, and"
4110,hope that these blooms of the dawn will be carried safely to land
4111,in the night.
4112,i launch my paper boats and look up into the sky and see the
4113,little clouds setting thee white bulging sails.
4114,i know not what playmate of mine in the sky sends them down
4115,the air to race with my boats!
4116,when night comes i bury my face in my arms and dream that my
4117,paper boats float on and on under the midnight stars.
4118,"the fairies of sleep are sailing in them, and the lading ins"
4119,their baskets full of dreams.
4120,parting words 
4121,when i go from hence 
4122,"let this be my parting word, "
4123,that what i have seen is unsurpassable. 
4124,i have tasted of the hidden honey of this lotus 
4125,"that expands on the ocean of light, "
4126,and thus am i blessed 
4127,---let this be my parting word. 
4128,in this playhouse of infinite forms 
4129,i have had my play 
4130,and here have i caught sight of him that is formless. 
4131,my whole body and my limbs 
4132,have thrilled with his touch who is beyond touch; 
4133,"and if the end comes here, let it come "
4134,---let this be my parting word.
4135,passing breeze 
4136,"yes, i know, this is nothing but thy love, "
4137,"o beloved of my heart---this golden light that dances upon the leaves, "
4138,"these idle clouds sailing across the sky, "
4139,this passing breeze leaving its coolness upon my forehead. 
4140,the morning light has flooded my eyes---this is thy message to my heart. 
4141,"thy face is bent from above, thy eyes look down on my eyes, "
4142,and my heart has touched thy feet.
4143,patience by rabindranath tagore
4144,if thou speakest not i will fill my heart with thy silence and endure it. 
4145,i will keep still and wait like the night with starry vigil 
4146,and its head bent low with patience. 
4147,"the morning will surely come, the darkness will vanish, "
4148,and thy voice pour down in golden streams breaking through the sky. 
4149,"then thy words will take wing in songs from every one of my birds' nests, "
4150,and thy melodies will break forth in flowers in all my forest groves.
4151,"child, how happy you are sitting in the dust, playing with a broken twig all the morning. "
4152,i smile at your play with that little bit of a broken twig. 
4153,"i am busy with my accounts, adding up figures by the hour. "
4154,"perhaps you glance at me and think, ""what a stupid game to spoil your morning with!"" "
4155,"child, i have forgotten the art of being absorbed in sticks and mud-pies. "
4156,"i seek out costly playthings, and gather lumps of gold and silver. "
4157,"with whatever you find you create your glad games, i spend both my time and my strength over things i never can obtain. "
4158,"in my frail canoe i struggle to cross the sea of desire, and forget that i too am playing a game."
4159,"`prisoner, tell me, who was it that bound you?' "
4160,"`it was my master,' said the prisoner. "
4161,"`i thought i could outdo everybody in the world in wealth and power, "
4162,and i amassed in my own treasure-house the money due to my king. 
4163,"when sleep overcame me i lay upon the bed that was for my lord, "
4164,and on waking up i found i was a prisoner in my own treasure-house.' 
4165,"`prisoner, tell me, who was it that wrought this unbreakable chain?' "
4166,"`it was i,' said the prisoner, `who forged this chain very carefully. "
4167,i thought my invincible power would hold the world captive 
4168,leaving me in a freedom undisturbed. 
4169,thus night and day i worked at the chain 
4170,with huge fires and cruel hard strokes. 
4171,when at last the work was done 
4172,"and the links were complete and unbreakable, "
4173,i found that it held me in its grip.'
4174,"life of my life, i shall ever try to keep my body pure, knowing "
4175,that thy living touch is upon all my limbs. 
4176,"i shall ever try to keep all untruths out from my thoughts, knowing "
4177,that thou art that truth which has kindled the light of reason in my mind. 
4178,i shall ever try to drive all evils away from my heart and keep my 
4179,"love in flower, knowing that thou hast thy seat in the inmost shrine of my heart. "
4180,"and it shall be my endeavour to reveal thee in my actions, knowing it "
4181,is thy power gives me strength to act.
4182,roaming cloud 
4183,i am like a remnant of a cloud of autumn 
4184,"uselessly roaming in the sky, o my sun ever-glorious! "
4185,"thy touch has not yet melted my vapor, "
4186,"making me one with thy light, "
4187,and thus i count months and years separated from thee. 
4188,"if this be thy wish and if this be thy play, "
4189,"then take this fleeting emptiness of mine, "
4190,"paint it with colors, gild it with gold, "
4191,float it on the wanton wind and spread it in varied wonders. 
4192,"and again when it shall be thy wish to end this play at night, "
4193,"i shall melt and vanish away in the dark, "
4194,"or it may be in a smile of the white morning, "
4195,in a coolness of purity transparent.
4196,sail away 
4197,"early in the day it was whispered that we should sail in a boat, "
4198,"only thou and i, and never a soul in the world would know of this our "
4199,pilgrimage to no country and to no end. 
4200,"in that shoreless ocean, "
4201,"at thy silently listening smile my songs would swell in melodies, "
4202,"free as waves, free from all bondage of words. "
4203,is the time not come yet? 
4204,are there works still to do? 
4205,"lo, the evening has come down upon the shore "
4206,and in the fading light the seabirds come flying to their nests. 
4207,"who knows when the chains will be off, "
4208,"and the boat, like the last glimmer of sunset, "
4209,vanish into the night?
4210,"in one salutation to thee, my god, "
4211,let all my senses spread out and touch this world at thy feet. 
4212,like a rain-cloud of july 
4213,hung low with its burden of unshed showers 
4214,let all my mind bend down at thy door in one salutation to thee. 
4215,let all my songs gather together their diverse strains into a single current 
4216,and flow to a sea of silence in one salutation to thee. 
4217,like a flock of homesick cranes flying night and day 
4218,back to their mountain nests 
4219,let all my life take its voyage to its eternal home 
4220,in one salutation to thee.
4221,on the seashore of endless worlds children meet. 
4222,the infinite sky is motionless overhead 
4223,and the restless water is boisterous. 
4224,on the seashore of endless worlds 
4225,the children meet with shouts and dances. 
4226,they build their houses with sand 
4227,and they play with empty shells. 
4228,with withered leaves they weave their boats 
4229,and smilingly float them on the vast deep. 
4230,children have their play on the seashore of worlds. 
4231,"they know not how to swim, they know not how to cast nets. "
4232,"pearl fishers dive for pearls, merchants sail in their ships, "
4233,while children gather pebbles and scatter them again. 
4234,"they seek not for hidden treasures, they know not how to cast nets. "
4235,the sea surges up with laughter 
4236,and pale gleams the smile of the sea beach. 
4237,"death-dealing waves sing meaningless ballads to the children, "
4238,even like a mother while rocking her baby's cradle. 
4239,"the sea plays with children, "
4240,and pale gleams the smile of the sea beach. 
4241,on the seashore of endless worlds children meet. 
4242,"tempest roams in the pathless sky, "
4243,"ships get wrecked in the trackless water, "
4244,death is abroad and children play. 
4245,on the seashore of endless worlds is the 
4246,great meeting of children.
4247,deliverance is not for me in renunciation. 
4248,i feel the embrace of freedom in a thousand bonds of delight. 
4249,thou ever pourest for me the fresh draught of thy wine of various 
4250,"colours and fragrance, filling this earthen vessel to the brim. "
4251,my world will light its hundred different lamps with thy flame 
4252,and place them before the altar of thy temple. 
4253,"no, i will never shut the doors of my senses. "
4254,the delights of sight and hearing and touch will bear thy delight. 
4255,"yes, all my illusions will burn into illumination of joy, "
4256,and all my desires ripen into fruits of love.
4257,"she who ever had remained in the depth of my being, "
4258,in the twilight of gleams and of glimpses; 
4259,"she who never opened her veils in the morning light, "
4260,"will be my last gift to thee, my god, folded in my final song. "
4261,words have wooed yet failed to win her; 
4262,persuasion has stretched to her its eager arms in vain. 
4263,"i have roamed from country to country keeping her in the core of my heart, "
4264,and around her have risen and fallen the growth and decay of my life. 
4265,"over my thoughts and actions, my slumbers and dreams, "
4266,she reigned yet dwelled alone and apart. 
4267,many a man knocked at my door and asked for her 
4268,and turned away in despair. 
4269,"there was none in the world who ever saw her face to face, "
4270,and she remained in her loneliness waiting for thy recognition.
4271,signet of eternity 
4272,the day was when i did not keep myself in readiness for thee; 
4273,"and entering my heart unbidden even as one of the common crowd, "
4274,"unknown to me, my king, thou didst press the signet of eternity upon "
4275,many a fleeting moment of my life. 
4276,"and today when by chance i light upon them and see thy signature, "
4277,i find they have lain scattered in the dust mixed with the memory of 
4278,joys and sorrows of my trivial days forgotten. 
4279,"thou didst not turn in contempt from my childish play among dust, "
4280,and the steps that i heard in my playroom 
4281,are the same that are echoing from star to star.
4282,silent steps 
4283,have you not heard his silent steps? 
4284,"he comes, comes, ever comes. "
4285,"every moment and every age, "
4286,"every day and every night he comes, comes, ever comes. "
4287,"many a song have i sung in many a mood of mind, "
4288,"but all their notes have always proclaimed, "
4289,"`he comes, comes, ever comes.' "
4290,"in the fragrant days of sunny april through the forest path he comes, "
4291,"comes, ever comes. "
4292,in the rainy gloom of july nights on the thundering chariot of clouds 
4293,"he comes, comes, ever comes. "
4294,"in sorrow after sorrow it is his steps that press upon my heart, "
4295,and it is the golden touch of his feet that makes my joy to shine.
4296,sit smiling 
4297,i boasted among men that i had known you. 
4298,they see your pictures in all works of mine. 
4299,"they come and ask me, `who is he?' "
4300,"i know not how to answer them. i say, `indeed, i cannot tell.' "
4301,they blame me and they go away in scorn. 
4302,and you sit there smiling. 
4303,i put my tales of you into lasting songs. 
4304,the secret gushes out from my heart. 
4305,"they come and ask me, `tell me all your meanings.' "
4306,i know not how to answer them. 
4307,"i say, `ah, who knows what they mean!' "
4308,they smile and go away in utter scorn. 
4309,and you sit there smiling
4310,in the night of weariness 
4311,"let me give myself up to sleep without struggle, "
4312,resting my trust upon thee. 
4313,let me not force my flagging spirit into a poor preparation for thy worship. 
4314,it is thou who drawest the veil of night upon the tired eyes of the day 
4315,to renew its sight in a fresher gladness of awakening.
4316,song unsung by rabindranath tagore
4317,the song that i came to sing remains unsung to this day. 
4318,i have spent my days in stringing and in unstringing my instrument. 
4319,"the time has not come true, the words have not been rightly set; "
4320,only there is the agony of wishing in my heart. 
4321,the blossom has not opened; only the wind is sighing by. 
4322,"i have not seen his face, nor have i listened to his voice; "
4323,only i have heard his gentle footsteps from the road before my house. 
4324,the livelong day has passed in spreading his seat on the floor; 
4325,but the lamp has not been lit and i cannot ask him into my house. 
4326,i live in the hope of meeting with him; but this meeting is not yet.
4327,still heart 
4328,when i give up the helm 
4329,i know that the time has come for thee to take it. 
4330,what there is to do will be instantly done. 
4331,vain is this struggle. 
4332,then take away your hands 
4333,"and silently put up with your defeat, my heart, "
4334,and think it your good fortune to sit perfectly still 
4335,where you are placed. 
4336,"these my lamps are blown out at every little puff of wind, "
4337,and trying to light them i forget all else again and again. 
4338,"but i shall be wise this time and wait in the dark, "
4339,spreading my mat on the floor; 
4340,"and whenever it is thy pleasure, my lord, "
4341,come silently and take thy seat here.
4342,stream of life
4343,the same stream of life that runs through my veins night and day 
4344,runs through the world and dances in rhythmic measures. 
4345,it is the same life that shoots in joy through the dust of the earth 
4346,in numberless blades of grass 
4347,and breaks into tumultuous waves of leaves and flowers. 
4348,it is the same life that is rocked in the ocean-cradle of birth 
4349,"and of death, in ebb and in flow. "
4350,i feel my limbs are made glorious by the touch of this world of life. 
4351,and my pride is from the life-throb of ages dancing in my blood this moment
4352,"my desires are many and my cry is pitiful, "
4353,but ever didst thou save me by hard refusals; 
4354,and this strong mercy has been wrought into my life through and through. 
4355,"day by day thou art making me worthy of the simple, "
4356,"great gifts that thou gavest to me unasked---this sky and the light, this body and the "
4357,life and the mind---saving me from perils of overmuch desire. 
4358,there are times when i languidly linger 
4359,and times when i awaken and hurry in search of my goal; 
4360,but cruelly thou hidest thyself from before me. 
4361,day by day thou art making me worthy of thy full acceptance by 
4362,"refusing me ever and anon, saving me from perils of weak, uncertain desire."
4363,"mother, your baby is silly! she is so absurdly childish!"
4364,she does not know the difference between the lights in the
4365,streets and the stars.
4366,"when we play at eating with pebbles, she thinks they are real"
4367,"food, and tries to put them into her mouth."
4368,"when i open a book before her and ask her to learn her a, b,"
4369,"c, she tears the leaves with her hands and roars for joy at"
4370,nothing; this is your baby's way of doing her lesson.
4371,when i shake my head at her in anger and scold her and call
4372,"her naughty, she laughs and thinks it great fun."
4373,"everybody knows that father is away, but if in play i call"
