,TEXT
0,"a tree a tree beside the sandy river-beach      holds up its topmost boughs  like fingers towards the skies they cannot reach,      earth-bound, heaven amorous. "
1,this is the soul of man. body and brain  hungry for earth our heavenly flight detain. 
2,sri krishna
3,"o immense light and thou, o spirit-wide boundless space, whom have you clasped and hid, deathless limbs, gloried face?  vainly lie 'space and time, ""void are we, there is none."" vainly strive self and world crying, ""i, i alone.""  one is there, self of self, soul of space, fount of time, heart of hearts, mind of minds, he alone sits, sublime. oh, no void absolute self-absorbed, splendid, mute, hands that clasp hold and red lips that kiss blow the flute.  all he loves, all he moves, all are his, all are he!  many limbs sate his whims, hear his sweet ecstasy. two in one, two who know difference rich in sense, two to clasp, one to be, this his strange mystery."
4,who
5," in the blue of the sky, in the green of the forest, whose is the hand that has painted the glow? when the winds were asleep in the womb of the ether, who was it roused them and bade them to blow?"
6,"he is lost in the heart, in the cavern of nature, he is found in the brain where he builds up the thought: in the pattern and bloom of the flowers he is woven, in the luminous net of the stars he is caught."
7,"in the strength of a man, in the beauty of woman, in the laugh of a boy, in the blush of a girl; the hand that sent jupiter spinning through heaven, spends all its cunning to fashion a curl."
8,these are his works and his veils and his shadows; but where is he then? by what name is he known? is he brahma or vishnu? a man or a woman? bodied or bodiless? twin or alone?
9,"we have love for a boy who is dark and resplendent, a woman is lord of us, naked and fierce. we have seen him a-muse on the snow of the mountains, we have watched him at work in the heart of the spheres."
10,"we will tell the whole world of his ways and his cunning: he has rapture of torture and passion and pain; he delights in our sorrow and drives us to weeping, then lures with his joy and his beauty again. all music is only the sound of his laughter, all beauty the smile of his passionate bliss; our lives are his heart-beats, our rapture the bridal of radha and krishna, our love is their kiss."
11,"he is strength that is loud in the blare of the trumpets, and he rides in the car and he strikes in the spears; he slays without stint and is full of compassion; he wars for the world and its ultimate years."
12,"in the sweep of the worlds, in the surge of the ages, ineffable, mighty, majestic and pure, beyond the last pinnacle seized by the thinker he is throned in his seats that for ever endure."
13,"the master of man and his infinite lover, he is close to our hearts, had we vision to see; we are blind with our pride and the pomp of our passions, we are bound in our thoughts where we hold ourselves free."
14,"it is he in the sun who is ageless and deathless, and into the midnight his shadow is thrown; when darkness was blind and engulfed within darkness, he was seated within it immense and alone."
15,revelation
16," someone leaping from the rocks past me ran with windblown locks like a startled bright surmise visible to mortal eyes, — just a cheek of frightened rose that with sudden beauty glows, just a footstep like the wind and a hurried glance behind, and then nothing, — as a thought escapes the mind ere it is caught. someone of the heavenly rout from behind the veil ran out."
17,the silver call
18," there is a godhead of unrealised things to which time's splendid gains are hoarded dross; a cry seems near, a rustle of silver wings calling to heavenly joy by earthly loss."
19," all eye has seen and all the ear has heard is a pale illusion by some greater voice and mightier vision; no sweet sound or word, no passion of hues that make the heart rejoice"
20," can equal these diviner ecstasies. a mind beyond our mind has sole the ken of those yet unimagined harmonies, the fate and privilege of unborn men."
21," as rain-thrashed mire the marvel of the rose, earth waits that distant marvel to disclose."
22,surrender
23,"o thou of whom i am the instrument, o secret spirit and nature housed in me, let all my mortal being now be blent in thy still glory of divinity."
24," i have given my mind to be dug thy channel mind, i have offered up my will to be thy will : let nothing of myself be left behind in our union mystic and unutterable."
25, my heart shall throb with the world-beats of thy 1ove; my body become thy engine for earth-use; in my nerves and veins thy rapture's streams shall move ; my thoughts shall be hounds of light for thy power to loose.
26, keep only my soul to adore eternally and meet thee in each form and soul of thee.
27,krishna
28,"           at last i find a meaning of soul's birth            into this universe terrible and sweet,      i who have felt the hungry heart of earth          aspiring beyond heaven to krishna's feet."
29,"      i have seen the beauty of immortal eyes,         and heard the passion of the lover's flute,"
30,     and known a deathless ecstasy's surprise        and sorrow in my heart for ever mute.
31,"     nearer apd nearer now the music draws,          life shudders with a strange felicity;     all nature is a wide enamoured pause         hoping her lord to touch, to clasp, to be."
32,     for this one moment lived the ages past;    the world now throbs fulfilled in me at last
33,the blue bird
34, i am the bird of god in his blue; divinely high and clear i sing the notes of the sweet and the true for the god's and the seraph's ear.
35,i rise like a fire from the mortal's earth into a griefless sky and drop in the suffering soil of his birth fire-seeds of ecstasy.
36,my pinions soar beyond time and space into unfading light; i bring the bliss of the eternal's face and the boon of the spirit's sight.
37,i measure the worlds with my ruby eyes; i have perched on wisdom's tree thronged with the blossoms of paradise by the streams of eternity.
38,"nothing is hid from my burning heart; my mind is shoreless and still; my song is rapture's mystic art, my flight immortal will."
39,"bride of the fire bride of the fire, clasp me now close, - bride of the fire! i have shed the bloom of the earthly rose, i have slain desire."
40,"beauty of the light, surround my life, - beauty of the light! i have sacrificed longing and parted from grief, i can bear thy delight."
41,"image of ecstasy, thrill and enlace, - image of bliss! i would see only thy marvellous face, feel only thy kiss."
42,"voice of infinity, sound in my heart, - call of the one! stamp there thy radiance, never to part, o living sun."
43,a god's labour
44,"i have gathered my dreams in a silver air between the gold and the blue and wrapped them softly and left them there, my jewelled dreams of you."
45,i had hoped to build a rainbow bridge marrying the soil to the sky and sow in this dancing planet midge the moods of infinity.
46,"but too bright were our heavens, too far away, too frail their ethereal stuff; too splendid and sudden our light could not stay; the roots were not deep enough."
47,he who would bring the heavens here must descend himself into clay and the burden of earthly nature bear and tread the dolorous way.
48,"coercing my godhead i have come down here on the sordid earth, ignorant, labouring, human grown twixt the gates of death and birth."
49,"i have been digging deep and long mid a horror of filth and mire a bed for the golden river’s song, a home for the deathless fire."
50,i have laboured and suffered in matter’s night to bring the fire to man; but the hate of hell and human spite are my meed since the world began. 
51,musa spiritus
52," o word concealed in the upper fire, thou who hast lingered through centuries, descend from thy rapt white desire, plunging through gold eternities."
53,"into the gulfs of our nature leap, voice of the spaces, call of the light! break the seals of matter's sleep, break the trance of the unseen height."
54,"in the uncertain glow of human mind, its waste of unharmonied thronging thoughts, carve thy epic mountain-lined crowded with deep prophetic grots."
55,let thy hue-winged lyrics hover like birds over the swirl of the heart's sea. touch into sight with thy fire-words the blind indwelling deity.
56,"o muse of the silence, the wideness make in the unplumbed stillness that hears thy voice, in the vast mute heavens of the spirit awake where thy eagles of power flame and rejoice."
57,"out, out with the mind and its candles flares, light, light the suns that never die. for my ear the cry of the seraph stars and the forms of the gods for my naked eye!"
58,"let the little troubled life-god within cast his veils from the still soul, his tiger-stripes of virtue and sin, his clamour and glamour and thole and dole;"
59,invitation
60, with wind and the weather beating round me      up to the hill and the moorland i go. who will come with me? who will climb with me? wade through the brook and tramp through the snow?
61,not in the petty circle of cities cramped by your doors and your walls i dwell; over me god is blue in the welkin         against me the wind and the storm rebel.
62,"i sport with solitude here in my regions,                of misadventure have me a friend. who would live largely?who would live freely?                  here to the wind-swept uplands ascend."
63,"i am the lord of tempest and mountain,           i am the spirit of freedom and pride. stark must he be and a kinsman to danger     who shares my kingdom and walks at my side"
64,the miracle of birth
65,"i saw my soul a traveller through time;      from life to life the cosmic ways it trod,  obscure in the depths and on the heights sublime,      evolving from the worm into the god. "
66,"a spark of the eternal fire, it came      to build a house in matter for the unborn.  the inconscient sunless night received the flame,      in the brute seed of things dumb and forlorn "
67,"life stirred and thought outlined a gleaming shape      till on the stark inanimate earth could move,  born to somnambulist nature in her sleep      a thinking creature who can hope and love. "
68,"still by slow steps the miracle goes on,  the immortal's gradual birth mid mire and stone. "
69,because thou art
70,"because thou art all-beauty and all-bliss,      my soul blind and enamoured yearns for thee;  it bears thy mystic touch in all that is      and thrills with the burden of that ecstasy. "
71,behind all eyes i meet thy secret gaze      and in each voice i hear thy magic tune:  thy sweetness haunts my heart through nature's ways      nowhere it beats now from thy snare immune. 
72,it loves thy body in all living things;      thy joy is there in every leaf and stone:  the moments bring thee on their fiery wings;      sight's endless artistry is thou alone. 
73,time voyages with thee upon its prow   and all the futures passionate hope is thou
74,the inner fields
75," there is a brighter ether than this blue pretence of an enveloping heavenly vault, royaler investiture than this massed assault of emerald rapture pearled with tears of dew. immortal spaces of cerulean hue are in our reach and fields without this fault of drab brown earth and streams that never halt in their deep murmur which white flowers strew"
76,floating like stars upon a strip of sky. this world behind is made of truer stuff than the manufactured tissue of earth's grace. there we can walk and see the gods go by and sip from hebe's cup nectar enough to make for us heavenly limbs and deathless face.
77,the golden light
78,"thy golden light came down into my brain and the grey rooms of mind sun-touched became a bright reply to wisdom's occult plane, a calm illumination and a flame."
79,"thy golden light came down into my throat, and all my speech is now a tune divine, a paean-song of thee my single note; my words are drunk with the immortal's wine."
80,thy golden light came down into my heart smiting my life with thy eternity; now has it grown a temple where thou art and all its passions point towards only thee.
81,"thy golden light came down into my feet, my earth is now thy playfield and thy seat."
82,evolution (revised)
83,i passed into a lucent still abode and saw as in a mirror crystalline an ancient force ascending serpentine the unhasting spirals of the aeonic road.
84,earth was a cradle for the arriving god and man but a half-dark half-luminous sign of the transition of the veiled divine from matter's sleep and the tormented load
85,"of ignorant life and death to the spirit's light. mind liberated swam light's ocean vast, and life escaped from its grey tortured line;"
86,i saw matter illumining its parent night. the soul could feel into infinity cast timeless god-bliss the heart incarnadine.
87,bande mataram
88,"mother, i bow to thee! rich with thy hurrying streams, bright with thy orchard gleams, cool with thy winds of delight, dark fields waving, mother of might, mother free."
89,"glory of moonlight dreams over thy branches and lordly streams, clad in thy blossoming trees, mother, giver of ease, laughing low and sweet! mother, i kiss thy feet, speaker sweet and low! mother, to thee i bow."
90,"who hath said thou art weak in thy lands, when the swords flash out in twice seventy million hands and seventy millions voices roar thy dreadful name from shore to shore? with many strengths who art mighty and stored, to thee i call, mother and lord! thou who savest, arise and save! to her i cry who ever her foemen drave back from plain and sea and shook herself free."
91,"thou art wisdom, thou art law, thou our heart, our soul, our breath, thou the love divine, the awe in our hearts that conquers death. thine the strength that nerves the arm, thine the beauty, thine the charm. every image made divine in our temples is but thine."
92,"thou art durga, lady and queen, with her hands that strike and her swords of sheen, thou art lakshmi lotus-throned, pure and perfect without peer, mother, lend thine ear. rich with thy hurrying streams, bright with thy orchard gleams, dark of hue, o candid-fair"
93," in thy soul, with jewelled hair and thy glorious smile divine, loveliest of all earthly lands, showering wealth from well-stored hands! mother, mother mine! mother sweet, i bow to thee, mother great and free."
94,the word of the silence
95," a bare impersonal hush is now my mind, a world of sight clear and inimitable, a volume of silence by a godhead signed, a greatness pure, virgin of will."
96,"once on its pages ignorance could write in a scribble of intellect the blind guess of time and cast gleam-messages of ephemeral light, a food for souls that wander on nature's rim."
97,but now i listen to a greater word born from the mute unseen omniscient ray: the voice that only silence' ear has heard leaps missioned from an eternal glory of day.
98,all turns from a wideness and unbroken peace to a tumult of joy in a sea of wide release.
99,the universal incarnation
100,"there is a wisdom like a brooding sun, a bliss in the heart's crypt grown fiery white, the heart of a world in which all hearts are one, a silence on the mountains of delight."
101,"a calm that cradles fate upon its knees; a wide compassion leans to embrace earth's pain; a witness dwells within our secrecies, the incarnate godhead in the body of man."
102,"our mind is a glimmering curtain of that ray, our strength a parody of the immortal's power, our joy a dreamer on the eternal's way hunting the fugitive beauty of an hour."
103,"only on the heart's veiled door the word of flame is written, the secret and tremendous name."
104,the witness spirit
105,"i dwell in the spirit's calm nothing can move and watch the actions of thy vast world-force, its mighty wings that through infinity move and the time-gallopings of the deathless horse."
106,"this mute stupendous energy that whirls the stars and nebulae in its long train, like a huge serpent through my being curls with its diamond hood of joy and fangs of pain."
107,"it rises from the dim inconscient deep upcoiling through the minds and hearts of men, then touches on some height of luminous sleep the bliss and splendour of the eternal plane."
108,"all this i bear in me, untouched and still assenting to thy all-wise inscrutable will."
109,nirvana
110,"all is abolished but the mute alone. the mind from thought released, the heart from grief, grow inexistent now beyond belief; there is no i, no nature, known-unknown. the city, a shadow picture without tone, floats, quivers unreal; forms without relief flow, a cinema's vacant shapes; like a reef foundering in shoreless gulfs the world is done."
111,"only the illimitable permanent is here. a peace stupendous, featureless, still. replaces all, - what once was i, in it  a silent unnamed emptiness content either to fade in the unknowable or thrill with the luminous seas of the infinite."
112,the call of the impossible
113,"our godhead calls us in unrealised things. asleep in the wide fields of destiny, a world guarded by silence' rustling wings sheltered their fine impossibility."
114,"but part, but quiver the cerulean gates, close splendours look into our dreaming eyes; we bear proud deities and magnificent fates; faces and hands come near from paradise."
115,"what shone thus far above is here in us; bliss unattained our future's birthright is; beauty of our dim soul is amorous, we are the heirs of infinite widenesses."
116,"the impossible is the hint of what shall be, mortal the door to immortality."
117,the dreamboat
118,"who was it that came to me in a boat made of dream-fire, with his flame brow and his sun-gold body? melted was the silence into a sweet secret murmur, ""do you come now? is the heart's fire ready?"""
119,"hidden in the recesses of the heart something shuddered, it recalled all that the life's joy cherished, imaged the felicity it must leave lost forever, and the boat passed and the gold god vanished."
120,"now within the hollowness of the world's breast inhabits -  for the love died and the old joy ended -  void of a felicity that has fled, gone for ever, and the gold god and the dream boat come not."
121,cosmic consciousness
122,"i have wrapped the wide world in my wider self and time and space my spirit's seeing are. i am the god and demon, ghost and elf, i am the wind's speed and the blazing star."
123,"all nature is the nursling of my care, i am its struggle and the eternal rest; the world's joy thrilling runs through me, i bear the sorrow of millions in my lonely breast."
124,"i have learned a close identity with all, yet am by nothing bound that i become; carrying in me the universe's call i mount to my imperishable home."
125,"i pass beyond time and life on measureless wings, yet still am one with born and unborn things."
126,the kingdom within
127,"there is a kingdom of the spirit's ease.         it is not in this helpless swirl of thought,         foam from the world-sea or spray-whisper caught, with which we build mind's shifting symmetries, nor in life's stuff of passionate unease,         nor the heart's unsure emotions frailty wrought         nor trivial clipped sense-joys soon brought to nought nor in this body's solid transiences."
128,"wider behind than the vast universe         our spirit scans the drama and the stir, a peace, a light, an ecstasy, a power waiting at the end of blindness and the curse         that veils it from its ignorant minister, the grandeur of its free eternal hour."
129,life and death
130,"life, death, - death, life; the words have led for ages our thought and consciousness and firmly seemed two opposites; but now long-hidden pages are opened, liberating truths undreamed. life only is, or death is life disguised, - life a short death until by life we are surprised."
131,bride of the fire
132," bride of the fire, clasp me now close, -  bride of the fire! i have shed the bloom of the earthly rose, i have slain desire."
133,"beauty of the light, surround my life, -  beauty of the light! i have sacrificed longing and parted from grief, i can bear thy delight."
134,"image of ecstasy, thrill and enlace, -  image of bliss! i would see only thy marvellous face, feel only thy kiss."
135,"voice of infinity, sound in my heart, -  call of the one! stamp there thy radiance, never to part, o living sun."
136,ocean oneness
137,"silence is round me, wideness ineffable; white birds on the ocean diving and wandering; a soundless sea on a voiceless heaven, azure on azure, is mutely gazing."
138,"identified with silence and boundlessness my spirit widens clasping the universe till all that seemed becomes the real, one in a mighty and single vastness."
139,"someone broods there nameless and bodiless, conscious and lonely, deathless and infinite, and, sole in a still eternal rapture, gathers all things to his heart for ever."
140,i have a hundred lives
141,"i have a hundred lives before me yet to grasp thee in, o spirit ethereal, be sure i will with heart insatiate pursue thee like a hunter through them all."
142,"thou yet shalt turn back on the eternal way and with awakened vision watch me come smiling a little at errors past and lay  thy eager hand in mine, its proper home."
143,"meanwhile made happy by thy happiness i shall approach thee in things and people dear,  and in thy spirit's motions half-possess, loving what thou hast loved, shall feel thee near,"
144,"until i lay my hands on thee indeed somewhere among the stars, as 'twas decreed."
145,the unseen infinite
146,"arisen to voiceless unattainable peaks i meet no end, for all is boundless he, an absolute joy the wide-winged spirit seeks, a might, a presence, an eternity."
147,"in the inconscient dreadful dumb abyss are heard the heart-beats of the infinite. the insensible midnight veils his trance of bliss, a fathomless sealed astonishment of light."
148,"in his ray that dazzles our vision everywhere, our half-closed eyes seek fragments of the one: only the eyes of immortality dare to look unblinded on that living sun."
149,"yet are our souls the immortal's selves within, comrades and powers and children of the unseen."
150,life
151,"mystic miracle, daughter of delight,  life, thou ecstasy, let the radius of thy flight be eternity."
152,"on thy wings thou bearest high glory and disdain, godhead and mortality, ecstasy and pain."
153,"take me in thy wild embrace  without weak reserve body dire and unveiled face; faint not, life, nor swerve."
154,"all thy bliss i would explore, all thy tyranny. cruel like the lion's roar, sweet like springtide be."
155,"like a titan i would take, like a god enjoy, like a man contend and make, revel like a boy."
156,"more i will not ask of thee, nor my fate would choose; king or conquered let me be, live or lose."
157,"even in rags i am a god; fallen, i am divine; high i triumph when down-trod, long i live when slain."
158,god
159,"thou who pervadest all the worlds below, yet sitst above, master of all who work and rule and know, servant of love!"
160,"thou who disdainest not the worm to be  nor even the clod, therefore we know by that humility that thou art god."
161,liberation
162,"i have thrown from me the whirling dance of mind and stand now in the spirit's silence free, timeless and deathless beyond creature-kind, the centre of my own eternity."
163,"i have escaped and the small self is dead; i am immortal, alone, ineffable; i have gone out from the universe i made, and have grown nameless and immeasurable."
164,"my mind is hushed in a wide and endless light, my heart a solitude of delight and peace, my sense unsnared by touch and sound and sight, my body a point in white infinities."
165,"i am the one being's sole immobile bliss: no one i am, i who am all that is."
166,soul in the ignorance
167," soul in the ignorance, wake from its stupor. flake of the world-fire, spark of divinity, lift up thy mind and thy heart into glory. sun in the darkness, recover thy lustre."
168,"one, universal, ensphering creation, wheeling no more with inconscient nature, feel thyself god-born, know thyself deathless. timeless return to thy immortal existence."
169,the godhead
170,"i sat behind the dance of danger's hooves in the shouting street that seemed a futurist's whim, and suddenly felt, exceeding nature's grooves, in me, enveloping me the body of him."
171," above my head a mighty head was seen, a face with the calm of immortality and an omnipotent gaze that held the scene in the vast circle of its sovereignty."
172," his hair was mingled with the sun and breeze ; the world was in his heart and he was i: i housed in me the everlasting's peace, the strength of one whose substance cannot die."
173,the moment passed and all was as before; only that deathless memory i bore.
174,transformation: sonnet
175,my breath runs in a subtle rhythmic stream; it fills my members with a might divine: i have drunk the infinite like a giant’s wine. time is my drama or my pageant dream. now are my illumined cells joy’s flaming scheme and changed my thrilled and branching nerves to fine channels of rapture opal and hyaline for the influx of the unknown and the supreme.
176,"i am no more a vassal of flesh, a slave to nature and her leaden rule; i am caught no more in the senses’ narrow mesh. my soul unhorizoned widens to measureless sight, my body is god’s happy living tool, my spirit a vast sun of deathless light."
177,to weep because
