,TEXT
968,"on many an idle day have i grieved over lost time.  but it is never lost, my lord.  thou hast taken every moment of my life in thine own hands. "
969,"hidden in the heart of things thou art nourishing seeds into sprouts,  buds into blossoms, and ripening flowers into fruitfulness. "
970,i was tired and sleeping on my idle bed  and imagined all work had ceased.  in the morning i woke up  and found my garden full with wonders of flowers.
971,lotus 
972,"on the day when the lotus bloomed, alas, my mind was straying,  and i knew it not. my basket was empty and the flower remained unheeded. "
973,"only now and again a sadness fell upon me, and i started up from my  dream and felt a sweet trace of a strange fragrance in the south wind. "
974,that vague sweetness made my heart ache with longing and it seemed to  me that is was the eager breath of the summer seeking for its completion. 
975,"i knew not then that it was so near, that it was mine, and that this  perfect sweetness had blossomed in the depth of my own heart."
976,lover's gifts ii: come to my garden walk 
977,"come to my garden walk, my love. pass by the fervid flowers that press themselves on your sight. pass them by, stopping at some chance joy, which like a sudden wonder of sunset illumines, yet elude. for lover's gift is shy, it never tells its name, it flits across the shade, spreading a shiver of joy along the dust. overtake it or miss it for ever. but a gift that can be grasped is merely a frail flower, or a lamp with flame that will flicker."
978,lover's gifts iv: she is near to my heart 
979,"she is near to my heart as the meadow-flower to the earth; she is sweet to me as sleep is to tired limbs. my love for her is my life flowing in its fullness, like a river in autumn flood, running with serene abandonment. my songs are one with my love, like the murmur of a stream, that sings with all its waves and current."
980,lover's gifts lii: tired of waiting 
981,"tired of waiting, you burst your bonds, impatient flowers, before the winter had gone. glimpses of the unseen comer reached your wayside watch, and you rushed out running and panting, impulsive jasmines, troops of riotous roses. you were the first to march to the breach of death, your clamour of colour and perfume troubled the air. you laughed and pressed and pushed each other, bared your breast and dropped in heaps. the summer will come in its time, sailing in the flood-tide of the south wind. but you never counted slow moments to be sure of him. you recklessly spent your all in the road, in the terrible joy of faith. you heard his footsteps from afar, and flung your mantle of death for him to tread upon. your bonds break even before the rescuer is seen, you make him your own ere he can come and claim you. "
982,lover's gifts liv: in the beginning of time 
983,"in the beginning of time, there rose from the churning of god's dream two women. one is the dancer at the court of paradise, the desired of men, she who laughs and plucks the minds of the wise from their cold meditations and of fools from their emptiness; and scatters them like seeds with careless hands in the extravagant winds of march, in the flowering frenzy of may. the other is the crowned queen of heaven, the mother, throned on the fullness of golden autumn; she who in the harvest-time brings straying hearts to the smile sweet as tears, the beauty deep as the sea of silence, -brings them to the temple of the unknown, at the holy confluence of life and death. "
984,lover's gifts lviii: things throng and laugh 
985,"things throng and laugh loud in the sky; the sands and dust dance and whirl like children. man's mind is aroused by their shouts; his thoughts long to be the playmates of things. our dreams, drifting in the stream of the vague, stretch their arms to clutch the earth, -their efforts stiffen into bricks and stones, and thus the city of man is built. voices come swarming from the past,-seeking answers from the living moments. beats of their wings fill the air with tremulous shadows, and sleepless thoughts in our minds leave their nests to take flight across the desert of dimness, in the passionate thirst for forms. they are lampless pilgrims, seeking the shore of light, to find themselves in things. they will be lured into poets's rhymes, they will be housed in the towers of the town not yet planned, they have their call to arms from the battle fields of the future, they are bidden to join hands in the strife of peace yet to come."
986,lover's gifts lxx: take back your coins 
987,"take back your coins, king's councillor. i am of those women you sent to the forest shrine to decoy the young ascetic who had never seen a women. i failed in your bidding. dimly day was breaking when the hermit boy came to bathe in the stream, his tawny locks crowded on his shoulders, like a cluster of morning clouds, and his limbs shining like a streak of sunbeam. we laughed and sang as we rowed in our boat; we jumped into the river in a mad frolic, and danced around him, when the sun rose staring at us from the water's edge in a flush of divine anger. like a child-god, the boy opened his eyes and watched our movements, the wonder deepening till his eyes shone like morning stars. he lifted his clasped hands and chanted a hymn of praise in his bird-like young voice, thrilling every leaf of the forest. never such words were sung to a mortal woman before; they were like the silent hymn to the dawn which rises from the hushed hills. the women hid their mouths with their hands, their bodies swaying with laughter, and a spasm of doubt ran across his face. quickly came i to his side, sorely pained, and, bowing to his feet, i said, ""lord, accept my service."" i led him to the grassy bank, wiped his body with the end of my silken mantle, and, kneeling on the ground, i dried his feet with my trailing hair. when i raised my face and looked into his eyes, i thought i felt the world's first kiss to the first woman,  -blessed am i, blessed is god, who made me a woman. i heard him say to me, ""what god unknown are you? your touch is the touch of the immortal, your eyes have the mystery of the midnight."" ah, no, not that smile, king's councillor, -the dust of worldly wisdom has covered your sight, old man. but this boy's innocence pierced the mist and saw the shining truth, the woman divine.... the women clapped their hands, and laughed their obscene laugh, and with veils dragged on the dust and hair hanging loose they began to pelt him with flowers. alas, my spotless sun, could not my shame weave fiery mist to cover you in its folds? i fell at his feet and cried, ""forgive me. "" i fled like a stricken deer through shade and sun, and cried as i fled, "" forgive me. "" the women's foul laughter pressed me like a cracking fire, but the words ever rang in my ears, "" what god unknown are you?"""
988,lover's gifts v: i would ask for still more
989,"i would ask for still more, if i had the sky with all its stars, and the world with its endless riches; but i would be content with the smallest corner of this earth if only she were mine. "
990,lover's gifts viii: there is room for you 
991,"there is room for you. you are alone with your few sheaves of rice. my boat is crowded, it is heavily laden, but how can i turn you away? your young body is slim and swaying; there is a twinkling smile in the edge of your eyes, and your robe is coloured like the rain cloud. the travellers will land for different roads and homes. you will sit for a while on the prow of my boat, and at the journey's end none will keep you back. where do you go, and to what home, to garner your sheaves? i will not question you, but when i fold my sails and moor my boat i shall sit and wonder in the evening, -where do you go, and to what home, to garner your sheaves?"
992,lover's gifts xiii: last night in the garden 
993,"last night in the garden i offered you my youth's foaming wine. you lifted the cup to your lips, you shut your eyes and smiled while i raised your veil, unbound your tresses, drawing down upon my breast your face sweet with its silence, last night when the moon's dream overflowed the world of slumber. to-day in the dew-cooled calm of the dawn you are walking to god's temple, bathed and robed in white, with a basketful of flowers in your hand. i stand aside in the shade under the tree, with my head bent, in the calm of the dawn by the lonely road to the temple."
994,lover's gifts xix: it is written in the book 
995,"it is written in the book that man, when fifty, must leave the noisy world, to go to the forest seclusion. but the poet proclaims that the forest hermitage is only for the young. for it is the birthplace of flowers and the haunt of birds and bees; and hidden hooks are waiting there for the thrill of lovers' whispers. there the moon-light, that is all one kiss for the malati flowers, has its deep message, but those who understand it are far below fifty. and alas, youth is inexperienced and wilful, therefore it is but meet that the old should take charge of the household, and the young take to the seclusion of forest shades and the severe discipline of courting. "
996,lover's gifts xl: a message came 
997,"a message came from my youth of vanished days, saying, "" i wait for you among the quivering of unborn may, where smiles ripen for tears and hours ache with songs unsung."" it says, ""come to me across the worn-out track of age, through the gates of death. for dreams fade, hopes fail, the fathered fruits of the year decay, but i am the eternal truth, and you shall meet me again and again in your voyage of life from shore to shore."""
998,lover's gifts xlii: are you a mere picture 
999,"are you a mere picture, and not as true as those stars, true as this dust? they throb with the pulse of things, but you are immensely aloof in your stillness, painted form. the day was when you walked with me, your breath warm, your limbs singing of life. my world found its speech in your voice, and touched my heart with your face. you suddenly stopped in your walk, in the shadow-side of the forever, and i went on alone. life, like a child, laughs, shaking its rattle of death as it runs; it beckons me on, i follow the unseen; but you stand there, where you stopped behind that dust and those stars; and you are a mere picture. no, it cannot be. had the life-flood utterly stopped in you, it would stop the river in its flow, and the foot-fall of dawn in her cadence of colours. had the glimmering dusk of your hair vanished in the hopeless dark, the woodland shade of summer would die with its dreams. can it be true that i forgot you? we haste on without heed, forgetting the flowers on the roadside hedge. yet they breathe unaware into our forgetfulness, filling it with music. you have moved from my world, to take seat at the root of my life, and therefore is this forgetting-remembrance lost in its own depth. you are no longer before my songs, but one with them. you came to me with the first ray of dawn. i lost you with the last gold of evening. ever since i am always finding you through the dark. no, you are no mere picture. "
1000," lover's gifts xliii: dying, you have left behind "
1001,"dying, you have left behind you the great sadness of the eternal in my life. you have painted my thought's horizon with the sunset colours of your departure, leaving a track of tears across the earth to love's heaven. clasped in your dear arms, life and death united in me in a marriage bond. i think i can see you watching there in the balcony with your lamp lighted, where the end and the beginning of all things meet. my world went hence through the doors that you opened-you holding the cup of death to my lips, filling it with life from your own. "
1002,lover's gifts xliv: where is heaven 
1003,"where is heaven? you ask me, my child,-the sages tell us it is beyond the limits of birth and death, unswayed by the rhythm of day and night; it is not of the earth. but your poet knows that its eternal hunger is for time and space, and it strives evermore to be born in the fruitful dust. heaven is fulfilled in your sweet body, my child, in your palpitating heart. the sea is beating its drums in joy, the flowers are a-tiptoe to kiss you. for heaven is born in you, in the arms of the mother- dust."
1004,lover's gifts xlvii: the road is 
1005,"the road is my wedded companion. she speaks to me under my feet all day, she sings to my dreams all night. my meeting with her had no beginning, it begins endlessly at each daybreak, renewing its summer in fresh flowers and songs, and her every new kiss is the first kiss to me. the road and i are lovers. i change my dress for her night after night, leaving the tattered cumber of the old in the wayside inns when the day dawns."
1006,lover's gifts xlviii: i travelled the old road 
1007,"i travelled the old road every day, i took my fruits to the market, my cattle to the meadows, i ferried my boat across the stream and all the ways were well known to me. one morning my basket was heavy with wares. men were busy in the fields, the pastures crowded with cattle; the breast of earth heaved with the mirth of ripening rice. suddenly there was a tremor in the air, and the sky seemed to kiss me on my forehead. my mind started up like the morning out of mist. i forgot to follow the track. i stepped a few paces from the path, and my familiar world appeared strange to me, like a flower i had only known in bud. my everyday wisdom was ashamed. i went astray in the fairyland of things. it was the best luck of my life that i lost my path that morning, and found my eternal childhood."
1008,lover's gifts xvi: she dwelt here by the pool 
1009,"she dwelt here by the pool with its landing-stairs in ruins. many an evening she had watched the moon made dizzy by the shaking of bamboo leaves, and on many a rainy day the smell of the wet earth had come to her over the young shoots of rice. her pet name is known here among those date-palm groves and in the courtyards where girls sit and talk while stitching their winter quilts. the water in this pool keeps in its depth the memory of her swimming limbs, and her wet feet had left their marks, day after day, on the footpath leading to the village. the women who come to-day with their vessels to the water have all seen her smile over simple jests, and the old peasant, taking his bullocks to their bath, used to stop at her door every day to greet her. many a sailing-boat passes by this village; many a traveller takes rest beneath that banyan tree; the ferry-boat crosses to yonder ford carrying crowds to the market; but they never notice this spot by the village road, near the pool with its ruined landing-stairs,-where dwelt she whom i love."
1010,lover's gifts xviii: your days 
1011,"your days will be full of cares, if you must give me your heart. my house by the cross-roads has its doors open and my mind is absent, -for i sing. i shall never be made to answer for it, if you must give me your heart. if i pledge my word to you in tunes now, and am too much in earnest to keep it when music is silent, you must forgive me; for the law laid down in may is best broken in december. do not always keep remembering it, if you must give me your heart. when your eyes sing with love, and your voice ripples with laughter, my answers to your questions will be wild, and not miserly accurate in facts, -they are to be believed for ever and then forgotten for good. "
1012,"lover's gifts xxii: i shall gladly suffer  i shall gladly suffer the pride of culture to die out in my house, if only in some happy future i am born a herd-boy in the brinda forest. the herd-boy who grazes his cattle sitting under the banyan tree, and idly weaves gunja flowers into garlands, who loves to splash and plunge in the jamuna's cool deep stream. he calls his companions to wake up when morning dawns, and all the houses in the lane hum with the sound of the churn, clouds of dust are raised by the cattle, the maidens come out in the courtyard to milk the king. as the shadows deepen under the tomal trees, and the dusk gathers on the river-banks; when the milkmaids, while crossing the turbulent water, tremble with fear; and loud peacocks, with tails outspread, dance in the forest, he watchers the summer clouds. when the april night is sweet as a fresh-blown flower, he disappears in the forest with a peacock's plume in his hair; the swing ropes are twined with flowers on the branches; the south wind throbs with music, and the merry shepherd boys crowd on the banks of the blue river. no, i will never be the leader, brothers, of this new age of new bengal; i shall not trouble to light the lamp of culture for the benighted. if only i could be born, under the shady asoka groves, in some village of brinda, where milk is churned by the maidens!"
1013,lover's gifts xxviii: i dreamt 
1014,"i dreamt that she sat by my head, tenderly ruffling my hair with her fingers, playing the melody of her touch. i looked at her face and struggled with my tears, till the agony of unspoken words burst my sleep like a bubble. i sat up and saw the glow of the milky way above my window, like a world of silence on fire, and i wondered if at this moment she had a dream that rhymed with mine."
1015,lover's gifts xxxix: there is a looker-on 
1016,"things in ages and worlds beyond memory's shore, and those forgotten sights glisten on the grass and shiver on the leaves. he has seen under new veils the face of the one beloved, in twilight hours of many a nameless star. therefore his sky seems to ache with the pain of countless meetings and partings, and a longing pervades this spring breeze, -the longing that is full of the whisper of ages without beginning."
1017,maya 
1018," that i should make much of myself and turn it on all sides,  thus casting colored shadows on thy radiance  ---such is thy maya. "
1019,thou settest a barrier in thine own being  and then callest thy severed self in myriad notes.  this thy self-separation has taken body in me. 
1020,"the poignant song is echoed through all the sky in many-coloued tears  and smiles, alarms and hopes; waves rise up and sink again,  dreams break and form.  in me is thy own defeat of self. "
1021,"this screen that thou hast raised is painted with innumerable figures  with the brush of the night and the day.  behind it thy seat is woven in wondrous mysteries of curves,  casting away all barren lines of straightness. "
1022,"the great pageant of thee and me has overspread the sky.  with the tune of thee and me all the air is vibrant,  and all ages pass with the hiding and seeking of thee and me."
1023,moment's indulgence 
1024,i ask for a moment's indulgence to sit by thy side. the works  that i have in hand i will finish afterwards. 
1025,"away from the sight of thy face my heart knows no rest nor respite,  and my work becomes an endless toil in a shoreless sea of toil. "
1026,today the summer has come at my window with its sighs and murmurs; and the bees are plying their minstrelsy at the court of the flowering grove. 
1027,"now it is time to sit quite, face to face with thee, and to sing  dedication of life in this silent and overflowing leisure "
1028,my friend 
1029,"art thou abroad on this stormy night  on thy journey of love, my friend?  the sky groans like one in despair. "
1030,"i have no sleep tonight.  ever and again i open my door and look out on  the darkness, my friend! "
1031,i can see nothing before me.  i wonder where lies thy path! 
1032,"by what dim shore of the ink-black river,  by what far edge of the frowning forest,  through what mazy depth of gloom art thou threading  thy course to come to me, my friend? "
1033,my song 
1034,"this song of mine will wind its music around you, my child, like the fond arms of love. this song of mine will touch your forehead like a kiss of blessing. when you are alone it will sit by your side and whisper in your ear, when you are in the crowd it will fence you about with aloofness. my song will be like a pair of wings to your dreams, it will transport your heart to the verge of the unknown. it will be like the faithful star overhead when dark night is over your road. my song will sit in the pupils of your eyes, and will carry your sight into the heart of things. and when my voice is silent in death, my song will speak in your living heart. "
1035,o fool 
1036,"o fool, try to carry thyself upon thy own shoulders!  o beggar, to come beg at thy own door! "
1037,"leave all thy burdens on his hands who can bear all,  and never look behind in regret. "
1038,thy desire at once puts out the light from the lamp it touches with its breath. it is unholy---take not thy gifts through its unclean hands.  accept only what is offered by sacred love. 
1039,ocean of forms 
1040,"i dive down into the depth of the ocean of forms,  hoping to gain the perfect pearl of the formless. "
1041,no more sailing from harbor to harbor with this my weather-beaten boat.  the days are long passed when my sport was to be tossed on waves. 
1042,and now i am eager to die into the deathless. 
1043,into the audience hall by the fathomless abyss  where swells up the music of toneless strings  i shall take this harp of my life. 
1044,"i shall tune it to the notes of forever,  and when it has sobbed out its last utterance,  lay down my silent harp at the feet of the silent."
1045,old and new  thou hast made me known to friends whom i knew not.  thou hast given me seats in homes not my own.  thou hast brought the distant near and made a brother of the stranger. 
1046,"i am uneasy at heart when i have to leave my accustomed shelter;  i forget that there abides the old in the new,  and that there also thou abidest. "
1047,"through birth and death, in this world or in others,  wherever thou leadest me it is thou, the same,  the one companion of my endless life  who ever linkest my heart with bonds of joy to the unfamiliar. "
1048,"when one knows thee, then alien there is none, then no door is shut.  oh, grant me my prayer that i may never lose  the bliss of the touch of the one  in the play of many. "
1049, on the seashore 
1050,"on the seashore of endless worlds children meet.  the infinite sky is motionless overhead and the restless water is boisterous. on the seashore of endless worlds the children meet with shouts and dances.  they build their houses with sand, and they play with empty shells. with withered leaves they weave their boats and smilingly float them on the vast deep. children have their play on the seashore of worlds.  they know not how to swim, they know not how to cast nets. pearl-fishers dive for pearls, merchants sail in their ships, while children gather pebbles and scatter them again. they seek not for hidden treasures, they know not how to cast nets.  the sea surges up with laughter, and pale gleams the smile of the sea-beach. death-dealing waves sing meaningless ballads to the children, even like a mother while rocking her baby's cradle. the sea plays with children, and pale gleams the smile of the sea-beach.  on the seashore of endless worlds children meet. tempest roams in the pathless sky, ships are wrecked in the trackless water, death is abroad and children play. on the seashore of endless worlds is the great meeting of children."
1051,only thee 
1052,"that i want thee, only thee---let my heart repeat without end.  all desires that distract me, day and night,  are false and empty to the core. "
1053,"as the night keeps hidden in its gloom the petition for light,  even thus in the depth of my unconsciousness rings the cry  ---`i want thee, only thee'. "
1054,"as the storm still seeks its end in peace  when it strikes against peace with all its might,  even thus my rebellion strikes against thy love  and still its cry is  ---`i want thee, only thee'."
1055,paper boats 
1056,"day by day i float my paper boats one by one down the running stream. in bid black letters i write my name on them and the name of the village where i live. i hope that someone in some strange land will find them and know who i am. i load my little boats with shiuli flower from our garden, and hope that these blooms of the dawn will be carried safely to land in the night. i launch my paper boats and look up into the sky and see the little clouds setting thee white bulging sails. i know not what playmate of mine in the sky sends them down the air to race with my boats! when night comes i bury my face in my arms and dream that my paper boats float on and on under the midnight stars. the fairies of sleep are sailing in them, and the lading ins their baskets full of dreams."
1057, parting words 
1058,"when i go from hence  let this be my parting word,  that what i have seen is unsurpassable. "
1059,"i have tasted of the hidden honey of this lotus  that expands on the ocean of light,  and thus am i blessed  ---let this be my parting word. "
1060,in this playhouse of infinite forms  i have had my play  and here have i caught sight of him that is formless. 
1061,"my whole body and my limbs  have thrilled with his touch who is beyond touch;  and if the end comes here, let it come  ---let this be my parting word."
1062,passing breeze 
1063,"yes, i know, this is nothing but thy love,  o beloved of my heart---this golden light that dances upon the leaves,  these idle clouds sailing across the sky,  this passing breeze leaving its coolness upon my forehead. "
1064,"the morning light has flooded my eyes---this is thy message to my heart.  thy face is bent from above, thy eyes look down on my eyes,  and my heart has touched thy feet."
1065,patience by rabindranath tagore if thou speakest not i will fill my heart with thy silence and endure it.  i will keep still and wait like the night with starry vigil  and its head bent low with patience. 
1066,"the morning will surely come, the darkness will vanish,  and thy voice pour down in golden streams breaking through the sky. "
