,TEXT
2864,"alone,  perplexed beyond all solace you saw in the misted mirror as a red-eyed teardrop fell from the drip-pad of your soft cheek to land like a pearl in the palm of your hand right on your heart line.....   unexpectedly the pearl  turns to gleaming gold with all hues of rainbow before exploding  without any shock or any force transporting you to a heavenly place.....   under clear azure sky without a cloud in sight wandering through freesia vales and cyclamen dells scented piquant with pinks, yellows, and purples, lilting with rich robin syllables  and warbley nightingale trills and edged entirely by magenta gobuleted magnolias each chalicing wine of enchanting to be alive! above blaze of flame of sweet wafting azalia blooms a fabled river  enchantedly runs......   with droplets like sun dew every ripple scintillates with hue that magical mix of pure sunlight with pure water that glows with spontaneous fuse so you take off your shoes like bathing in champaigne the water is bubbly and warm dispersing all worldy worries making you feel lighter than a feather and you float peaceful as gossamer laying on your back in the spa of the water's form......   elegent damsel flies and butterflies luster even more wonderful hues as the kiss of air from their wing-beats feels almost angelic on your skin! while waters sun-spangled ripples scintillatingly and safely pass completely right through you making you feel utterly refreshed, buoyant, pristine, effervesced! infused with vibrant health re-youthfulness returned you to your most zesty,  mirthful best.....   as sun-dappled scintillas dance an entrancing dance on the trunks of the magnolias reflected from the streamy ripples projecting the lowering sun, and as humming-birds  and shimmering green bees  head off to roost you leave the water to go home yourself....   after pausing under the saintedly natural cathedral  of a large green weeping willow to whisper within it's echo an appreciative prayer to the great creator of all natural bounties then....whoosh, you're back at home!   but you'll remember this place and come back here again to be at one with your maker and all that's lovingly made...... you'll know just when to return probably reminded by raindrops or whenever next you hold a tears pearl in your hand!  "
2865,bridge
2866,"parched earth crumbled at the slightest touch. roots shriveled, fruit rotted, fissures formed-- chasms ached with thirst.   your love seeps into my soil; breaches heal, roots swell-- i burst into bloom.   wind whispers forgiveness, limbs shiver with joy. your colors kiss my soul-- we breathe a bow of peace."
2867,peace the world together
2868," the world’s heartstrings, should strum in harmony, where oxygen longs only wars to cease. blessed are benign souls who bestow beauty, as mindful poets, weave love's masterpiece.   such sweet quintessence, like stars in a row, where some stand, hand in hand, out of the blue. let's unleash peace, a path we need follow, revealing rapport, our worlds never knew.   like starry lightshows, of lucid night skies, sparkling in unison, where silk songs play. diplomatic minds, be still and think wise, let’s learn from history, starting today.   dreaming of all life, where we can share rain, where souls can feel warmth, healing in love's light. embrace peace, after long eras of pain, so new generations won’t fear the night.   may friendly smiles fill souls with gentleness, living anew, this peace our lips profess."
2869,spill your peace
2870,"lead lost sheep through vale of fear, where raging storms threaten to tear down fence of safe haven. spill your peace upon barren deserts torched by horror of war lighten our hearts heavy with regret, gather restless in your gracious embrace."
2871,the real victory!
2872,"kings, presidents and chiefs  rule the world with the people’s fear; making law at their side, so they’ll keep  ruling the world from their comfy seats.  "
2873,"mastering the language of wars and hostilities, nothing to lose, just send armies to the battlefield!"
2874,"freedom, justice and independence, these concepts in politics are just theories  "
2875,"oh peace, will you ever be here?  i’ve never seen you in this sphere, i’ve just read about you in the myths. but i know that one day, you’ll be real."
2876,"they’ll see people screaming ‘’ cheers ‘’, as to celebrate the victory they have achieved ."
2877,"now all i got to do is write this rhyme , and wait for someone to understand what it means."
2878,"wait for people not to be sheep, and for societies to wake up from their sleep; so as to push hierarchies down to the deep. that’s how our kids will know the truth peace.  "
2879,where there is love
2880,where there is love there is life regardless of strife where there's desire there's a way  where there is sun a hopes ray peace is present each day 
2881,"where there is hope there is light  warmth lifts, renewed height  when we open our closed heart "
2882,when we search for a fresh start  peace will find a way 
2883,"where there's kindness there is love  all greed climb above where to give we don't dare  where walls fall, naked bare  true peace must stay  where there is god there is fate  surplus love, less hate  when his heart opened to give  when we may love him and live  in peace i pray "
2884,vigil
2885,"there is a magical peace in watching you sleep that’s not unlike the calm surrender of quietly observing a meandering river as it slowly wends its way down its muddy banks past reeds and grasses on the marshy shore to somewhere new and heretofore unknown   the current, steady as your unconscious breath moves through the cycles of your mind bringing you respite from the troubling stream of consciousness and pulling you down to a course of dreams where i like to think of you like that warm brown river flowing gently into me   you lie so quiet, still your breath bidding me closer like the river beckons the thirsty to drink would that i could drink you down so you really did flow through me quench me and bestow on me your peace"
2886,"surprise surprise surprise"""
2887,"my honey's a ""gem"" and he pampers me and promised his love eternally. valentine's day was coming our way-- what beautiful gift would i see?"
2888,"the day broke clear that early morn. i expected a package with bow adorned. but, woe is me! no gift did i see!~ i was feeling so sad and forlorn!"
2889,"my honey had a ""smirk"" on his face as he took me into his embrace. he said, ""close your eyes-- there's a big surprise!"" i balled up my fist, just in case!"
2890,"blindly, i was led to the lawn while i kept asking, ""what's going on?"" he said, ""wait and see-- i'm sure you'll agree-- all your worries will soon, be gone!"""
2891,"alas, i became so excited and my inner-fires ignited! i felt so elated  and anticipated that i would be so delighted."
2892,"slowly, i opened my eyes and much to my surprise-- what did i see in front of me ?? a ""clothesline"" with all it implies!"
2893,"now, the laughter filled the air! i didn't show signs of despair. i took control and embraced the pole-- he'll soon, have ""starch"" in his underwear!"
2894,surprise surprise pretty surprise
2895,"oh boy, a brand new slate you're all in for a huge surprise, just wait you thought i had money before? now i'll be sweating money from my pores this is just in time seriously i'm on cloud nine!"
2896,"surprise, surprise surprise"
2897,"never know whats in store for me for today, doctors or patients, ear pain, back pain or stuffed throat? "
2898,"surprise, surprise!!"
2899,"when you started talking to me again yesterday, it took me by complete surprise. i didn't know what to say really, i was in total shock. i still am even after reading the whole conversation again. "
2900,"you seem to have had a change of heart, but i'm not sure why. i'm glad that you did though, because i missed talking to you. maybe you realized that i had no part of it, that it was all just a misunderstanding."
2901,"i still can't believe that you wanted to see me before you left, after telling me not to talk to you any more. then to see the words ""you can call me some if you want."", has just really blew my mind!"
2902,"i'm still not sure what to think of it all, i guess you can say that i am kind of confused. all of a sudden here you are saying you want to chill with me, after telling me that you had changed your mind about anything else.   you acted just as interested as you did before, so i can't help but ask, what's up? have you changed your mind, had a change of heart? i sure hope you have, i had high hopes of it being more."
2903,"so i don't know where this will lead, i have to wait a while to see because you have already left, but i guess only time will tell! it is really up to you though, my friend."
2904,"surprise, surprise"
2905,"i called you once and you didn't respond even though you specifically said to call you sometime. okay, that's alright, maybe you were busy or didn't hear it.  either way, maybe i should try again later. . . again, nothing.  alright, i'll leave a message, even though i hate having to talk to a machine. i'll call sometime tomorrow."
2906,"once again nothing, maybe you're ignoring me, maybe i was wrong to hope that you and me... forget it."
2907," okay one more time, yes you answered! you'll be coming down later? awesome, great!  i'll be waiting. and waiting.  and waiting. i'll go watch tv."
2908,"what? you were here?  when?  you just left, no no! okay, i'll try again.  no answer... the next day, no answer... one more time, nothing... maybe she doesn't like me after all.  curse that god damned hope.  it got me again. "
2909,"surprise, surprise"
2910,"one moment can tell a story for years,  passed down with twists and turns...  but no matter how many distortions are made,  it is the original that is truly yours. "
2911,"'twas the first day of school,  such an interesting day,  i walked the halls nervously a lack of words to say. "
2912,"turning a corner,  i look up and around: a teacher asks a boy for his name,  i myself shocked by the sound:"
2913,the name has been spoken  and time seems to stop;  i look up at the boy in confusion and feel my jaw drop. 
2914,"no way! is it really him? you? he? that guy? the one i thought lost now returned, how? why? "
2915,was he not gone for such a period that i'd thought his return unseen: now this even is so abrupt!  it happened so quickly... 
2916,surprise surprise.
2917,we're best friends you & i but i love you and your brown eyes
2918,just a boy and a girl never torn apart afraid to date afraid to start
2919,never felt like this never opened up my heart till just lately now i know wasn't smart
2920,you told me before we'll be together soon but today you changed your mind now everything seems ruined
2921,i don't know what to say my face a blank stare tears flowing out my eyes  life really isn't fair
2922,you say you can't lose me and you didn't want to hurt me but there was no way around it now i ask you to let me be
2923,i need time to let you go i need space so i can think i'll never open up my heart again for it to only sink
2924,your still my best friend i'll always wish we were more but i respect your wish tho my feelings were tore. 
2925,"an 'elegy' for irony by glen martin fitch sharp trickster, how we loved to watch you tie our muddled minds into a knotted maze. your jests and jokes did twist each question, ""why?"" till heart and head were drugged in deadly daze. wise cynic, never have you had such praise for tense distortion, farce and helplessness. with hope abandoned, darkest night betrays ""dead"" land, ""dead"" minds and only death to bless. and yet in spite of lethe, i must confess my heart still beats and wiser have i grown, for, while i have no spirit left to guess, i know the constants even you have known. and so if queer queens love and scapegoats die won't spring reveal the truth of every “lie”?"
2926,aquamarine butterfly by nina gabriel aquamarine butterfly
2927,"by aquamarine waters of my kingdom, surrounded with splendor of treasures of my creations, in a hard shell of a crab, i was sitting and contemplating on my life’s journey, one day, as the golden rays of the sun touched the earth, the silky threads of my cocoon passed through my heart, thus illuminating my spirit, warming my body and soul. and as the night sky touched the earth, by the silver rays of the moon i was transformed into a butterfly, keeping the color of my kingdom of aquamarine colors i spread my wings as far as i could; two golden threads connected me to heaven from earth leading my path. and as i was transformed into a butterfly and given the wings to fly, and fly i did, as far as i could see. on my paths i discovered many places and many souls, some went along with me, some stayed behind to discover their own paths. my journey is not over yet, it seems that it has just began, once more, and this time around i plan to fly even further, spreading my wings far and wide, travel to different lands, sharing the splendor of my creations and gifts with the whole world, meeting the souls that are transformed into butterflies as well, this way we may all spread our sparkles of love and light, illuminating the paths for the rest that plan to follow us, on our souls’ path of the life’s journeys with love and light in our hearts. so you too, if you been transformed into a butterfly as well, come and join us on our flight to freedom through love, because this way we can all create beautiful heaven on earth and in our hearts were it all began."
2928,believe your heart by sweta leena panda sometimes people says don’t make wrong choice
2929,you will be forever alone
2930,however i believe no choice make me alone
2931,until & unless i want
2932,no doubt my tears are dry now
2933,& it’s now like river without water
2934,still my eyes are live
2935,who says many things?
2936,no doubt i hide it like the hidden treasure
2937,no one can open it
2938,because i lost the key of my treasure knowingly
2939,i believe if a person understands it without saying anything
2940, he/she truly loves
2941,"tear may fake, however eyes are true always "
2942,sometimes words may fake
2943,however heart is true always
2944,never judge a person by their words
2945,judge them by their heart
2946,because heart is a like an open precious treasure
2947,where you find many things which you never know
2948,"try to steal it, as it is very precious"
2949,always believe the words of your heart
2950,because it will never ever cheat you
2951,it always tells love & care for everyone
2952,however never ever take the words of everyone granted
2953,sometimes when we really need help
2954,these people become good spectator & listeners
2955,start saying about you
2956,without knowing  the story of you
2957,no person is copy of another
2958,so how people commenting others
2959,stop discuss about others
2960,"if you can’t help others,"
2961,at least don’t pull their legs down
2962,branches by ivy page if i knew that those sunday-school stories i heard would become
2963,"a ball of uncertainty rolling around inside me,"
2964,"if my parents hadn’t kicked me out for dating the youth pastor wannabe,"
2965,and i hadn’t moved in with the married lesbian.
2966,if the married lesbian hadn’t decided to divorce her husband
2967,"i wouldn’t have ended up living in athens, georgia where"
2968,"i would, in the span of a week discover that my boyfriend was"
2969,"cheating on me, miscarry our baby, and get mugged."
2970,if i hadn’t moved in with my ex-boyfriend’s mother after that
2971,"and then in with a distant cousin in milledgeville, georgia"
2972,where i would find my perceptions altered by practicing the loss
2973,"of time through smoke and mushrooms, multiple partners"
2974,and practicing being good enough* at karaoke. or if my drinking buddy
2975,hadn’t said that the guy running the karaoke night
2976,"was gay, so that i challenged — i would bet her a beer that i could"
2977,"get him in the sack, and if he hadn’t asked for my"
2978,number that same night only to tear it up a week later because i turned him
2979,down because i was still only seventeen and wouldn’t be
2980,let into the bar where he wanted to take me dancing. and if the drummer
2981,in the band i sang for hadn’t done twelve shots of white
2982,lightning the following new year’s and then urinated on me in bed because
2983,"he was in diabetic shock, and if i hadn’t covered the shift"
2984,"delivering pizzas for the girl i worked with, and if i hadn’t gone"
2985,"to the party, where the guy that ran karaoke"
2986,"read poetry, and i sang bad imitations of janis joplin—"
2987,"then i wouldn’t have ended up in place of eight month snows,"
2988,"married ten years to the guy that ran karaoke, and i wouldn’t be watching our"
2989,"two children recreating games of hopeful daisy chains, and"
2990,animal clouds. and if we had chosen any other branch?
2991,* “good enough” sarah mclachlan ** after w.s. merwin’s “one of the lives”
2992,from: any other branch
2993,myself
2994,"some call i m crazy some say i m sick i think it’s freedom however ,it helps release the pain that i go through every day feeling like everything's wrong i want to escape from my sadness however now i m looking forward i no longer feel like a coward any challenge put before me to stand and face it any blessing waiting for me to try and take it although almost brought tears however i promise i’ll never cry even if the battle seems lost never die although adversity is long humanity stronger"
2995,"ourney of a day our days begin with sunrise & ends with sunset often the days are seem useless, pointless we don’t think they matter but they do everything that happens has a reason the truth will be revealed in due season our life is a journey that we must make a road, a path, which we must take our course is never easy the stakes may be high we should not let our life like the leaves in winter life is a poem where we write our story everyday life is a game which we must play through trouble and disaster we never know what we will get our hand is not always get what we want we always learn a lesson of hearts and minds is taught however from the failure we should not walks on a street of hopeless & blind sometimes we find the face with in the face which hurt us most of the time? still we always expected to act like the world is as beautiful and clean if we struggle let it be with hope for things we wish to see so in every day let’s find you, knowing the world for its reality …+a184"
2996,"let go..a185 let go, a truth so bitter; let go, a wound so sore for nothing in life is permanent; and 'change' is the only constant !"
2997,"let go, a hidden drop of tear; let go, a secret concealed & obscured for a day that follows the night without remorse; from a grappling 'dusk' to a delighting 'dawn' !"
2998,"let go, the mask that covers your identity; let go, the shield that safeguards your dignity 'coz, you are the betrayer, the only traitor; who can deceive others but the real 'you' !"
2999,"let go, the profound pain that agonizes you; let go, the sinful urge that torments you for 'time' alone is the best healer; like a 'boon' to mankind in disguise !"
3000,"let go, the evil neighboring you; let go, the devil inside of you."
3001,your overblown 'ego' & overstated 'attitude' limitless idiosyncrasy & eccentricities!
3002,"let go, your fear, hurt & resentment; let go, broken promises & hollow commitments. for life is too petite to brood over 'insignificant issues' like grains of sand; waiting to be eroded with ceaseless time !!!!"
3003,"let us pull, pull the boat+a186 let us pull, pull the boat, young man… away from the waters safe on to land just the while perhaps till the morning and pull, young one…take a deep breath and pull… generations have worked and gone past exertion and into a discovery of inner strength and a sudden illumination perhaps of the resilience within… feel and pull - see, there’s the boat and you and the forces and the ground and there’s much within you… there’s the mark of the effort in your mind as footprints in the sand pull, young one…safe to land – a little more and a little more… and we are come to completion, and you will see within yourself where the struggle, where the living and all these days of our lives between earth and the oceans begin and end…"
3004,shining armour
3005,"a chest of metal, an eagle’s vision a teeth of sour girdle, an insight of taught mentions a plunging foot, a never dragging heart there a princess stood, but never a hint of look or any dart scorching suns were braved torenting skies were naived dust like a life stuck up in every breadth but the bronze turned skin shows his worth of every mile a sweet child’s look, an outsmarting tangle a heart wrapped up in pure satin to be lent, to without crave given... to the bronze man in the shining armour a metal built but without any doubt, human emotions he felt a mask of ignorance worn, a mask of love that was thrown days of blooming flowers, ages of moving clouds a touch of line upon the princess’ radiant skin shone a wage of a tower, but yet never held any power... his people mattered most he splattered wars of brave ones gone, yet he seemed as strong as sun but just as unique and lovely he was a gray tress came along, but never did the princess show a sign of crave w+a185ithdrawn she gazed and withheld the a184heart that was never given to hold neigh a quarter century but seventeen years of doom stay who says, every living moment was a precious day until a battle came, the same messenger to call them away the torrent warnings and swords flocked, the persons in numbers, they were all brave soldiers that flocked a life’s battle…so long will take maybe a fortnight or until the next full moon day her heart leapt just like it had for every rage in these seventeen years she crouched; she leaned to have the clearest view of her bronze man in the shining armour he was at his point’s sharpness, a heart of rage and a love for his men unmeasured a triumphant eagle’s scowl thrown a way to the highest he has never known but a look of gracious melodies, everlasting charms made a flash he turned to the tower, where he knew the princess stood and gave a look into her eyes and then to the skies as he always did a pleasure of pre-victory to have earned the world’s most precious gem but a look of plain bravery and everlasting plight but less did he know this would be his last sight with a brave leap onto his trustee he rode off... into the land of wilderness into the air of plain aura thus she held... thus she will tell... that this is my knight’s shining armour"
3006,"the day i may never see tomorrow, there's no written guarantee, i don't seem to understand, however i know who hold tomorrow, the great power, which shows me light every time i walk besides him, for he knows what is ahead, and things that happened yesterday belong to history, i cannot predict my future, i cannot change my past, i have just the present moment, i must treat it as my last, i must use this moment wisely for it soon will pass away, every step is getting brighter as the golden stairs i climb. every stars getting lighter, there the sun is always shining over my head, so there no fear for dark, i feel like touching the rainbow after a heavy rain, still i don't know about tomorrow, it may bring poverty, however i have faith upon someone, the one who stands by me, and path i follow & his presence always helps me to look forward, so i thanks god with humble heart for giving me this day, and his great blessing over my head..."
3007,a dream girl
3008,"before i have too much expectations for a girl. she must be smoking hot and very beautiful. she must be conservative, educated and rich but i now realize, you can't  have a perfect match."
3009,"i was looking around the city patiently waiting for a real love to say, ""come, my baby. marry me."" but i now realize, you can't buy or borrow love."
3010,i was a fool when i didn't notice a simple girl who made me happy every single day. she took away my loneliness and put a big drill into my closed and selfish heart.
3011,a big idea? by satish verma satish verma the moral dilemma was  unlearning.  less than truth. 
3012,downgrading the-  branded witch.  vaccine was spawning new virus. 
3013,"o buddha, why did you  started looking beautiful  and began sitting in a living room? "
3014,trailing the smoke  i was going to find the-  burning home. 
3015,what were those intimate-  words of unthinkable  dirty secrets? 
3016,"dying rose... by anselm vaz i found a rose, not red to see. its pettles with blisters crumpled down. it looked at me with a dead smile. uttering drops of tears and silent shivers. no speach to define, the pain and plunder. thinking of the past ectasy. taking sometime to survive. in the dark sunshine, with no glittering light to see."
3017,"oh! how was it picked by the lover winds, and stamped by foreseen legs. the wounds so deep, can't be healed. the plunder pain, can't let it sleep."
3018,"a magical prayer, i say to god. to heal this flower and take it away from me. so no pain would touch its hearts. and only smiles would make its way, to heavens gates, and the hells flames, would be waiting for me."
