,TEXT
11649,for every face showed stunned surprise
11650,no one expected me! 
11651,this morning’s surprise
11652,this morning’s surprise is how much i’ll miss rail travel.
11653,"the green fields looming up and falling behind,"
11654,"the milky tea wobbling in a plastic cup,"
11655,the engine’s steady vibration.
11656,"this afternoon’s surprise is how many shades of red there are,"
11657,"each one sitting in a room of its own, dense in meditation."
11658,"each one a field of conflict, a medium of conciliation."
11659,this evening’s surprise is not that the novel ends
11660,in a desultory return to the working week -
11661,loose ends trimmed and tucked out of sight -
11662,but the ferocity of my recoil
11663,at the author’s glib contrivance.
11664,midnight’s surprise is lorca’s moon floating over hackney
11665,"full-faced, round-eyed and speaking spanish."
11666,i hate poems
11667,"i try to write a poem,"
11668,but poems are too hard
11669,rhyming is for losers
11670,and airy-fairy bards
11671,to put a pen to paper
11672,and write about your life
11673,"i've had enough of all of those,"
11674,they only cause me strife
11675,"free-verse script is awful,"
11676,for fools without a beat
11677,repetition's far too simple
11678,"just repeat, repeat, repeat"
11679,"those lovey-dovey ode-things,"
11680,that wishy-washy crap
11681,"and poems about hatred,"
11682,you all deserve a slap
11683,"spare me all your ramblings,"
11684,i don't care how you feel
11685,your self-expression surely stinks
11686,of mouldy day-old eel
11687,to tell a tale of wonder
11688,never ceases to be trite
11689,to sing of magic wonders
11690,is nothing but pure ****e
11691,"your metaphors are useless,"
11692,your imagery is vile
11693,"your sense of diction makes me gag,"
11694,"i cannot stand your ""style"""
11695,"so save me your quotations,"
11696,please spare me all your rhyme
11697,shove that poem up your rear
11698,and cease to waste my time
11699,"i look at what i've written,"
11700,this jumble of clichés
11701,looks like i wrote a bloody poem
11702,so i'm the one to blame!
11703,this will be the last time
11704,"i currently drown in a black sea of a swirling abyss,"
11705,as you mould me to how you see fit --
11706,to how you wish me to be.
11707,"you can’t hear it, but i’m screaming on the inside."
11708,"it’s been days, but feels like it’s been years."
11709,i’ve become used to so much torture
11710,that my lace fringed heart stopped breathing.
11711,"now the empty shell of a woman only remains,"
11712,"but you’re pleased with what you’ve done,"
11713,as you marvel at the girl you destroyed.
11714,"now once that coppery sun has set,"
11715,i shall seek my deserving revenge.
11716,with all the hurt and anger i have bottled up
11717,you won’t make it out alive;
11718,you can count on that darling.
11719,the last thing you’ll see will be my charcoal eyes
11720,and the psychotic harlequin smile i don.
11721,be sure that i will rip out your ugly heart with my bare hands;
11722,staining and tarnishing their porcelain finish.
11723,this will be the last i waste my time on you.
11724,"with hugs and love always,"
11725,"sorry, my mask fell, what emotion was i wearing?"
11726,since the day i was born
11727,humanity always hated me
11728,anytime i accomplish something
11729,the critics always slated for free
11730,speaking of this weak flow
11731,and of each illiterate rhyme
11732,"always hearing ""last in show"""
11733,so i retained every word of mine...
11734,"but, look at me now, every rhyme will be sublime"
11735,and this flow of corrupt power runs the show
11736,so now they call it another crime 
11737,to express the feelings i don't know
11738,to write emotions in lifes spare time
11739,and for each new critic who trys to dictate
11740,"another tear sheds, emotions slow"
11741,"defenses shatter, breaking i let go."
11742,wake as essence torn asunder under bright stars
11743,minds obscured in this black i call mine
11744,mental blacklists entwine with physical scars
11745,losing control waiting for god's loving light to shine
11746,"stepping forward, critics rejoice, with headlights and black cars"
11747,                                                                
11748,here is hate-prejudice which thinks
11749,ill of others and there is love-prejudice
11750,which thinks well of others without
11751,"it's your choice, practice hate-prejudice"
11752,or try god's way with love-prejudice.
11753,is it worth the argument?
11754,gone and forgotten
11755, rotting away like time and wear
11756, i become frail like wilting roses
11757, yet they walk on by without a care
11758, and no one even supposes.
11759,  
11760," another page, another turn"
11761, but time after time they are blank
11762, and then my edges start to burn
11763, in place of where my heart sank.
11764,  
11765, i sit alone and decompose
11766, simmer out like a dying light
11767, and despite the poetry and the prose
11768, i slowly loose the fight.
11769,  
11770, now just a pile of cinder and soot
11771, i am swept to a corner to lay
11772, swept by society's heartless foot
11773, with nothing to feel and nothing to say.
11774,  
11775, slowly over time i start to disperse
11776, and blow away in specks of black
11777, and in this lonely pathetic verse
11778, it's too late for you to take it back.
11779,the inevitable end coming sooner than expected
11780,tell me one reason why
11781,i shouldn't do it
11782,jump from this building
11783,or tighten this noose
11784,"swallow these pills,"
11785,"or cut at my wrist,"
11786,why shouldn't i?
11787,life is a ****
11788,"why should i ""deal""?"
11789,or try to get by
11790,when all that i get is for me to cry
11791,"it can be over, ended, and done"
11792,"if i jump, or i can be hung"
11793,my stomach is boiling with the vile of society
11794,the cause for this bile coming out of me
11795,"for my image, does it matter though?"
11796,we all look the same when we meet our fate
11797,i'm closer to the night sky
11798,than to the earth below me
11799,here amongst the peaceful stars
11800,whose dazzling lights enclose me
11801,i've sat upon the crescent moon
11802,spoke of many wishes and dreams 
11803,i've watched the glow of shooting stars
11804,fall down in spiralled streams
11805,i'm sure i saw the spherical shimmer
11806,of other planets far beyond here
11807,i sent subliminal thoughts to them
11808,in the hope that they would answer
11809,i cried tears of loss and happiness
11810,for loved ones who breathe no more
11811,i miss their presence in my life
11812,and the times we shared before
11813,i know that with times passage
11814,hope will slowly flower and grow
11815,i feel its touch within my soul
11816,warming me and making me whole
11817,i've spent many a night flying free
11818,adrift in heavens splendour
11819,i'll stay in this velvet blue haven
11820,"until the sun, my soul awakens"
11821,in his hands
11822,in his hands i feel safe
11823,no harm can come to me
11824,for he holds me to his breast
11825,"and whispers ""i love thee."""
11826,in his hands there is love
11827,this gift he gave to me
11828,it is this gift of love
11829,that set my spirit free.
11830,in his hands there is life
11831,i am not alone
11832,he met me there at heaven's gate
11833,"and softly said ""come home."""
11834,i am sorry mom and dad
11835,for leaving you so soon
11836,even though i'm in his hands
11837,he is there with you.
11838,i feel my mind drifting
11839,drowsy now as dawn draws near.
11840,the shift in season means
11841,"i'll soon be gone, i fear."
11842,i feel my body tire
11843,while my spirit soars on higher.
11844,down my face there rolls
11845,"one lonely, laughing tear."
11846,"and oh, i hope the sun shines bright today."
11847,its shining spectacle will send me on my way.
11848,seems i've seen it all in a dream
11849,i know it's closer than it seems.
11850,for i've lost the urge to hideaway.
11851,there's no need to wander now;
11852,squandered too much anyhow
11853,and failed to find a thing i'd keep.
11854,perhaps true patience lies
11855,in lasting sleep.
11856,"and oh, i pray the sun shines bright today."
11857,its light will speed my flight and guide me to my grave.
11858,"the dream's come clear now, it calls to me,"
11859,"""run through the woods, boy and to the sea."
11860,"only there shall you be saved."""
11861,and blazed upon that forest floor
11862,there is a path i've walked before
11863,which wildly winds
11864,then finally finds the shore.
11865,i'll watch the waves until they crest
11866,then calmly lay these bones to rest.
11867,just another shell upon
11868,the sand forevermore.
11869,"and hey, look how the sun shines bright today!"
11870,poised on the horizon its rays riding every wave.
11871,such a lovely sight to see.
11872,think i'll take it away with me.
11873,to wherever it is i'll be.
11874,christmas 2008 -- a gift
11875,it is christmas soon.
11876,red and green and white
11877,cookies in jars; fruit cakes on trays;
11878,"presents secretively wrapped, betoken"
11879,with beloved names.
11880,christmas carols resound.
11881,joy glitters in eyes. sorrow flares up.
11882,fanfare cannot hide facades. the needy
11883,becomes more needy. melancholic. withdrawn.
11884,"or reach out, cutting the crust of indifference."
11885,"even those forgetting the real present,"
11886,are inevitably embraced by the warmth of love.
11887,at last i found the bread basket liners
11888,"i was looking for: two red cotton squares,"
11889,"the only two in the shop, but part of a set of four, "
11890,of which the other two disappeared.
11891,"no, madam, we may not sell those -- the set"
11892,is incomplete. 
11893,oh! but to me it is complete! i want only these two!
11894,will you please ask the manager if i may buy it?
11895,i asked this with such hope. 
11896,over a distance i saw his friendly smile while the attendant
11897,spoke to him.
11898,"he caught my eye, nodded, and grinned."
11899,"the attendant smiled too, when she reached me:"
11900,madam -- with compliments of the manager:
11901,your christmas present!
11902,"i waved at him, answered his grin, and nodded too. "
11903,joy to the world! our smiling eyes signaled. 
11904,"back at home kitkat, a true christmas cat, looked at me"
11905,"with a clear, knowing gaze:"
11906,it is christmas ... and his love  is in the air.
11907,our greatest gift.
11908,upon hitting the wall. . .
11909,where the still water gathers
11910,the peace of clear skies --
11911,"after the tumbled traipse,"
11912,rock and rill rollick --
11913,mountain face carving in creative
11914,"haste, all the youth of creek"
11915,falling and stumbling ‘cross
11916,"stone and branch in frothy dance,"
11917,this place of solitary glance
11918,‘neath the cool shadows of leaf
11919,near the fern and moss green mist.
11920,when i’ve lost my path amongst
11921,the wonders of love and bedazzled 
11922,by mysteries beyond my grasp --
11923,"my poetic voice, a memory scratched"
11924,"upon papers, bound, to show"
11925,where once my wonder pranced.
11926,emotions caught in lyrical beat.
11927,"i let myself be led to this source,"
11928,this place of infinite relief.
11929,"my aches pulse stilled, frustration shorn"
11930,the inner cacaphony -- want and need --
11931,"my children, clutch and grab at who i be,"
11932,"finally close their eyes, allow the mind to slumber."
11933,the inner ear within the soul becomes alert
11934,waits with surety for the truly  promised gift. 
11935,"the pond, bequeathed, unstirred by ripple or run"
11936,becomes a reflection of the source --
11937,"all gifts, mine since birth, wait for what’s to be heard."
11938,"the small still voice, we all seek,"
11939,"makes clear, without herald of storm, "
11940,awakens the creative seeds to flourish and grow
11941,where i had only seen barren loam. 
11942,"now reborn to the world’s harsh clatter,"
11943,i am healed and whole where once 
11944,"wounded and shattered. my words,"
11945,"dried and dusty, sere, squeezed to no meaning,"
11946,"once again, trumpet joy, are cups "
11947,rich in flavorful meaning to unclench the throat. 
11948,"walled with a cell, caught "
11949,"by my own humanness, tossed and torn"
11950,by competing needs -- i know
11951,i have the strength from the primal spring
11952,that love's me and has my constant thanks.
11953,"join me, upon the banks of this clear"
11954,"quiet pond, listen as you are imbued with serenity,"
11955,for the voice with which miracles blossom.
11956,"whether recognized or not, you will "
11957,be eternally changed and gifted
11958,for the time you have spent upon this spot. 
11959,join me in this simplistic environment.
11960,immerse yourself in the sweet nothingness of this paradise. 
11961,allow the cool breeze to blow past your worry-free mind.
11962,take my hand and embrace this feeling as we close our eyes. 
11963,"like a dream it seems, while we slowly float above."
11964,let’s savor this serene sensation.
11965,we'll bask in the dimming sunlight as the day evolves
11966,and we nurture our current elevation.
11967,hold me while we observe the graceful flight of the souls of the sky 
11968,and we witness the harmonic image of the lively sea spirits.
11969,"let your contentment seize control as we lay here, "
11970,listening to the subtle whistle of the calm wind.
11971,sail away with me in the depths of euphoria. 
11972,let's embark on this beautiful journey and we'll slowly descend.
11973,stay with me while we free-fall into my nirvana.
11974,we'll share the wondrous flavor of bliss
11975,"and feel the touch of pure tranquility,"
11976,rejuvenation is here!
11977,perplexed beyond all solace
11978,you saw in the misted mirror
11979,as a red-eyed teardrop
11980,fell from the drip-pad
11981,of your soft cheek
11982,to land like a pearl
11983,in the palm of your hand
11984,right on your heart line.....
11985,unexpectedly the pearl 
11986,turns to gleaming gold
11987,with all hues of rainbow
11988,before exploding 
11989,without any shock
11990,or any force
11991,to a heavenly place.....
11992,under clear azure sky
11993,without a cloud in sight
11994,wandering through freesia vales
11995,and cyclamen dells
11996,"with pinks, yellows, and purples,"
11997,lilting with rich robin syllables 
11998,and warbley nightingale trills
11999,and edged entirely
12000,by magenta gobuleted magnolias
12001,each chalicing wine
12002,of enchanting to be alive!
12003,above blaze of flame
12004,of sweet wafting azalia blooms
12005,a fabled river 
12006,with droplets like sun dew
12007,every ripple scintillates with hue
12008,that magical mix of pure sunlight
12009,with pure water
12010,that glows with spontaneous fuse
12011,so you take off your shoes
12012,like bathing in champaigne
12013,the water is bubbly and warm
12014,dispersing all worldy worries
12015,making you feel lighter than a feather
12016,and you float peaceful as gossamer
12017,laying on your back
12018,in the spa of the water's form......
12019,elegent damsel flies and butterflies
12020,luster even more wonderful hues
12021,as the kiss of air from their wing-beats
12022,feels almost angelic on your skin!
12023,while waters sun-spangled ripples
12024,scintillatingly and safely
12025,pass completely right through you
12026,"making you feel utterly refreshed,"
12027,"buoyant, pristine, effervesced!"
12028,infused with vibrant health
12029,"returned you to your most zesty, "
12030,as sun-dappled scintillas dance
12031,an entrancing dance
12032,on the trunks of the magnolias
12033,reflected from the streamy ripples
12034,"projecting the lowering sun,"
12035,and as humming-birds 
12036,and shimmering green bees 
12037,head off to roost
12038,you leave the water
12039,to go home yourself....
12040,after pausing under
12041,the saintedly natural cathedral 
12042,of a large green weeping willow
12043,to whisper within it's echo
12044,an appreciative prayer
12045,to the great creator
12046,of all natural bounties
12047,"then....whoosh, you're back at home!"
12048,but you'll remember this place
12049,and come back here again
12050,to be at one with your maker
12051,and all that's lovingly made......
12052,you'll know just when to return
12053,probably reminded by raindrops
12054,or whenever next
12055,you hold a tears pearl
12056,in your hand!
12057,crumbled at the slightest touch.
12058,"roots shriveled, fruit rotted,"
12059,chasms ached with thirst.
12060,seeps into my soil;
12061,"breaches heal, roots swell--"
12062,i burst into bloom.
12063,"wind whispers forgiveness,"
12064,limbs shiver with joy.
12065,your colors kiss my soul--
12066,we breathe a bow of peace.
12067,peace the world together
12068,"the world’s heartstrings, should strum in harmony,"
12069,where oxygen longs only wars to cease.
12070,"blessed are benign souls who bestow beauty,"
12071,"as mindful poets, weave love's masterpiece."
12072,"such sweet quintessence, like stars in a row,"
12073,"where some stand, hand in hand, out of the blue."
12074,"let's unleash peace, a path we need follow,"
12075,"revealing rapport, our worlds never knew."
12076,"like starry lightshows, of lucid night skies,"
12077,"sparkling in unison, where silk songs play."
12078,"diplomatic minds, be still and think wise,"
12079,"let’s learn from history, starting today."
12080,"dreaming of all life, where we can share rain,"
12081,"where souls can feel warmth, healing in love's light."
12082,"embrace peace, after long eras of pain,"
12083,so new generations won’t fear the night.
12084,"may friendly smiles fill souls with gentleness,"
12085,"living anew, this peace our lips profess."
12086,spill your peace
12087,through vale of
12088,"fear, where raging"
12089,storms threaten to tear
12090,down fence of safe haven.
12091,spill your peace upon barren
12092,deserts torched by horror of war
12093,"lighten our hearts heavy with regret,"
12094,gather restless in your gracious embrace.
12095,the real victory!
12096,"kings, presidents and chiefs "
12097,rule the world with the people’s fear;
12098,"making law at their side, so they’ll keep "
12099,ruling the world from their comfy seats.  
12100,"mastering the language of wars and hostilities,"
12101,"nothing to lose, just send armies to the battlefield!"
12102,"freedom, justice and independence,"
12103,these concepts in politics are just theories  
12104,"oh peace, will you ever be here? "
12105,"i’ve never seen you in this sphere,"
12106,i’ve just read about you in the myths.
12107,"but i know that one day, you’ll be real."
12108,"they’ll see people screaming ‘’ cheers ‘’,"
12109,as to celebrate the victory they have achieved .
12110,"now all i got to do is write this rhyme ,"
12111,and wait for someone to understand what it means.
12112,"wait for people not to be sheep,"
12113,and for societies to wake up from their sleep;
12114,so as to push hierarchies down to the deep.
12115,that’s how our kids will know the truth peace.
12116,where there is love
12117,where there is love there is life
12118,regardless of strife
12119,where there's desire there's a way 
12120,where there is sun a hopes ray
12121,peace is present each day 
12122,where there is hope there is light 
12123,"warmth lifts, renewed height "
12124,when we open our closed heart 
12125,when we search for a fresh start 
12126,peace will find a way 
12127,where there's kindness there is love 
12128,all greed climb above where to give we don't dare 
12129,"where walls fall, naked bare "
12130,true peace must stay 
12131,where there is god there is fate 
12132,"surplus love, less hate "
12133,when his heart opened to give 
12134,when we may love him and live 
12135,in peace i pray
12136,there is a magical peace in watching you sleep
12137,that’s not unlike the calm surrender
12138,of quietly observing a meandering river
12139,as it slowly wends its way down its muddy banks
12140,past reeds and grasses on the marshy shore
12141,to somewhere new and heretofore unknown
12142,"the current, steady as your unconscious breath"
12143,moves through the cycles of your mind
12144,bringing you respite from the troubling stream of consciousness
12145,and pulling you down to a course of dreams
12146,where i like to think of you
12147,like that warm brown river
12148,flowing gently into me
12149,"you lie so quiet, still"
12150,your breath bidding me closer
12151,like the river beckons the thirsty to drink
12152,would that i could drink you down
12153,so you really did flow through me
12154,and bestow on me your peace
12155,"surprise surprise surprise"""
12156,"my honey's a ""gem"" and he pampers me"
12157,and promised his love eternally.
12158,was coming our way--
12159,what beautiful gift would i see?
12160,the day broke clear that early morn.
12161,i expected a package with bow adorned.
12162,"but, woe is me!"
12163,no gift did i see!~
12164,i was feeling so sad and forlorn!
12165,"my honey had a ""smirk"" on his face"
12166,as he took me into his embrace.
12167,"he said, ""close your eyes--"
12168,"there's a big surprise!"""
12169,"i balled up my fist, just in case!"
12170,"blindly, i was led to the lawn"
12171,"while i kept asking, ""what's going on?"""
12172,"he said, ""wait and see--"
12173,i'm sure you'll agree--
12174,"all your worries will soon, be gone!"""
12175,"alas, i became so excited"
12176,and my inner-fires ignited!
12177,i felt so elated 
12178,that i would be so delighted.
12179,"slowly, i opened my eyes"
12180,and much to my surprise--
12181,what did i see
12182,in front of me ??
12183,"a ""clothesline"" with all it implies!"
12184,"now, the laughter filled the air!"
12185,i didn't show signs of despair.
12186,i took control
12187,and embraced the pole--
12188,"he'll soon, have ""starch"" in his underwear!"
12189,surprise surprise pretty surprise
12190,"oh boy, a brand new slate"
12191,"you're all in for a huge surprise, just wait"
12192,you thought i had money before?
12193,now i'll be sweating money from my pores
12194,this is just in time
12195,seriously i'm on cloud nine!
12196,"surprise, surprise surprise"
12197,"never know whats in store for me for today,"
12198,"doctors or patients,"
12199,"ear pain, back pain or stuffed throat?"
12200,"when you started talking to me again yesterday,"
12201,it took me by complete surprise.
12202,"i didn't know what to say really, i was in total shock."
12203,i still am even after reading the whole conversation again. 
12204,"you seem to have had a change of heart, but i'm not sure why."
12205,"i'm glad that you did though, because i missed talking to you."
12206,"maybe you realized that i had no part of it,"
12207,that it was all just a misunderstanding.
12208,"i still can't believe that you wanted to see me before you left,"
12209,after telling me not to talk to you any more.
12210,"then to see the words ""you can call me some if you want."","
12211,has just really blew my mind!
12212,"i'm still not sure what to think of it all,"
12213,i guess you can say that i am kind of confused.
12214,"all of a sudden here you are saying you want to chill with me,"
12215,after telling me that you had changed your mind about anything else.
12216,"you acted just as interested as you did before,"
12217,"so i can't help but ask, what's up?"
12218,"have you changed your mind, had a change of heart?"
12219,"i sure hope you have, i had high hopes of it being more."
12220,"so i don't know where this will lead,"
12221,"i have to wait a while to see because you have already left,"
12222,but i guess only time will tell!
12223,"it is really up to you though, my friend."
12224,i called you once and you didn't respond
12225,even though you specifically said to call you sometime.
12226,"okay, that's alright, maybe you were busy"
12227,"or didn't hear it.  either way, maybe i should try again later."
12228,"again, nothing.  alright, i'll leave a message,"
12229,even though i hate having to talk to a machine.
12230,i'll call sometime tomorrow.
12231,"once again nothing, maybe you're ignoring me,"
12232,maybe i was wrong to hope
12233,that you and me...
12234,"okay one more time, yes you answered!"
12235,you'll be coming down later?
12236,"awesome, great!  i'll be waiting."
12237,and waiting.  and waiting.
12238,i'll go watch tv.
12239,"what? you were here?  when?  you just left, no no!"
12240,"okay, i'll try again.  no answer..."
12241,"the next day, no answer..."
12242,"one more time, nothing... maybe she doesn't like me"
12243,after all.  curse that god damned hope.  it got me again.
12244,"one moment can tell a story for years, "
12245,passed down with twists and turns... 
12246,"but no matter how many distortions are made, "
12247,it is the original that is truly yours. 
12248,"'twas the first day of school, "
12249,"such an interesting day, "
12250,i walked the halls nervously
12251,a lack of words to say. 
12252,"turning a corner, "
12253,i look up and around:
12254,"a teacher asks a boy for his name, "
12255,i myself shocked by the sound:
12256,the name has been spoken 
12257,and time seems to stop; 
12258,i look up at the boy in confusion
12259,and feel my jaw drop. 
12260,no way! is it really him?
12261,you? he? that guy?
12262,the one i thought lost
12263,"now returned, how? why? "
12264,was he not gone for such a period
12265,that i'd thought his return unseen:
12266,now this even is so abrupt! 
12267,it happened so quickly...
12268,we're best friends
12269,you & i
12270,but i love you
12271,and your brown eyes
12272,just a boy and a girl
12273,never torn apart
12274,afraid to date
12275,afraid to start
12276,never felt like this
12277,never opened up my heart
12278,till just lately
12279,now i know wasn't smart
12280,you told me before
12281,we'll be together soon
12282,but today you changed your mind
12283,now everything seems ruined
12284,i don't know what to say
12285,my face a blank stare
12286,tears flowing out my eyes 
12287,life really isn't fair
12288,you say you can't lose me
