,TEXT
7756,in tattered robes that hoard a glittering trace 
7757,"of bygone colours, broidered to the knee, "
7758,"behold her, daughter of a wandering race, "
7759,"tameless, with the bold falcon's agile grace, "
7760,and the lithe tiger's sinuous majesty. 
7761,"with frugal skill her simple wants she tends, "
7762,she folds her tawny heifers and her sheep 
7763,"on lonely meadows when the daylight ends, "
7764,ere the quick night upon her flock descends 
7765,like a black panther from the caves of sleep. 
7766,time's river winds in foaming centuries 
7767,"its changing, swift, irrevocable course "
7768,to far off and incalculable seas; 
7769,"she is twin-born with primal mysteries, "
7770,and drinks of life at time's forgotten source
7771,the pardah nashin
7772,her life is a revolving dream 
7773,of languid and sequestered ease; 
7774,her girdles and her fillets gleam 
7775,like changing fires on sunset seas; 
7776,"her raiment is like morning mist, "
7777,"shot opal, gold and amethyst. "
7778,"from thieving light of eyes impure, "
7779,"from coveting sun or wind's caress, "
7780,her days are guarded and secure 
7781,"behind her carven lattices, "
7782,"like jewels in a turbaned crest, "
7783,like secrets in a lover's breast. 
7784,but though no hand unsanctioned dares 
7785,"unveil the mysteries of her grace, "
7786,"time lifts the curtain unawares, "
7787,and sorrow looks into her face . . . 
7788,"who shall prevent the subtle years, "
7789,or shield a woman's eyes from tears? 
7790,the poet to death
7791,"tarry a while, o death, i cannot die "
7792,while yet my sweet life burgeons with its spring; 
7793,"fair is my youth, and rich the echoing boughs "
7794,where dhadikulas sing. 
7795,"tarry a while, o death, i cannot die "
7796,"with all my blossoming hopes unharvested, "
7797,"my joys ungarnered, all my songs unsung, "
7798,and all my tears unshed. 
7799,"tarry a while, till i am satisfied "
7800,"of love and grief, of earth and altering sky; "
7801,"till all my human hungers are fulfilled, "
7802,"o death, i cannot die! "
7803,the poet's love-song
7804,"in noon-tide hours, o love, secure and strong, "
7805,i need thee not; mad dreams are mine to bind
7806,"the world to my desire, and hold the wind"
7807,a voiceless captive to my conquering song.
7808,"i need thee not, i am content with these:"
7809,"keep silence in thy soul, beyond the seas!"
7810,"but in the desolate hour of midnight, when"
7811,an ectasy of starry silence sleeps 
7812,"and my soul hungers for thy voice, o then,"
7813,"love, like the magic of wild melodies,"
7814,let thy soul answer mine across the seas. 
7815,the queen's rival
7816,"queen gulnaar sat on her ivory bed, "
7817,around her countless treasures were spread; 
7818,her chamber walls were richly inlaid 
7819,"with agate, porphory, onyx and jade; "
7820,"the tissues that veiled her delicate breast, "
7821,glowed with the hues of a lapwing's crest; 
7822,but still she gazed in her mirror and sighed 
7823,"""o king, my heart is unsatisfied."" "
7824,king feroz bent from his ebony seat: 
7825,"""is thy least desire unfulfilled, o sweet? "
7826,"""let thy mouth speak and my life be spent "
7827,"to clear the sky of thy discontent."" "
7828,"""i tire of my beauty, i tire of this "
7829,empty splendour and shadowless bliss; 
7830,"""with none to envy and none gainsay, "
7831,"no savour or salt hath my dream or day."" "
7832,queen gulnaar sighed like a murmuring rose: 
7833,"""give me a rival, o king feroz."" "
7834,king feroz spoke to his chief vizier: 
7835,"""lo! ere to-morrow's dawn be here, "
7836,"""send forth my messengers over the sea, "
7837,to seek seven beautiful brides for me; 
7838,"""radiant of feature and regal of mien, "
7839,"seven handmaids meet for the persian queen."" "
7840,. . . . . 
7841,"seven new moon tides at the vesper call, "
7842,king feroz led to queen gulnaar's hall 
7843,a young queen eyed like the morning star: 
7844,"""i bring thee a rival, o queen gulnaar."" "
7845,but still she gazed in her mirror and sighed: 
7846,"""o king, my heart is unsatisfied."" "
7847,"seven queens shone round her ivory bed, "
7848,"like seven soft gems on a silken thread, "
7849,"like seven fair lamps in a royal tower, "
7850,like seven bright petals of beauty's flower 
7851,queen gulnaar sighed like a murmuring rose 
7852,"""where is my rival, o king feroz?"" "
7853,"when spring winds wakened the mountain floods, "
7854,"and kindled the flame of the tulip buds,"
7855,"when bees grew loud and the days grew long, "
7856,"and the peach groves thrilled to the oriole's song, "
7857,"queen gulnaar sat on her ivory bed, "
7858,decking with jewels her exquisite head; 
7859,and still she gazed in her mirror and sighed: 
7860,"""o king, my heart is unsatisfied."" "
7861,"queen gulnsar's daughter two spring times old, "
7862,"in blue robes bordered with tassels of gold, "
7863,"ran to her knee like a wildwood fay, "
7864,and plucked from her hand the mirror away.
7865,quickly she set on her own light curls 
7866,her mother's fillet with fringes of pearls;
7867,quickly she turned with a child's caprice 
7868,"and pressed on the mirror a swift, glad kiss. "
7869,queen gulnaar laughed like a tremulous rose: 
7870,"""here is my rival, o king feroz."" "
7871,the royal tombs of golconda
7872,i muse among these silent fanes 
7873,whose spacious darkness guards your dust; 
7874,around me sleep the hoary plains 
7875,that hold your ancient wars in trust. 
7876,"i pause, my dreaming spirit hears, "
7877,"across the wind's unquiet tides, "
7878,"the glimmering music of your spears, "
7879,the laughter of your royal brides. 
7880,"in vain, o kings, doth time aspire "
7881,"to make your names oblivion's sport, "
7882,while yonder hill wears like a tier 
7883,the ruined grandeur of your fort. 
7884,"though centuries falter and decline, "
7885,your proven strongholds shall remain 
7886,"embodied memories of your line, "
7887,incarnate legends of your reign. 
7888,"o queens, in vain old fate decreed "
7889,your flower-like bodies to the tomb; 
7890,death is in truth the vital seed 
7891,of your imperishable bloom 
7892,each new-born year the bulbuls sing 
7893,their songs of your renascent loves; 
7894,your beauty wakens with the spring 
7895,to kindle these pomegranate groves. 
7896,the snake charmer
7897,whither dost thou hide from the magic of my flute-call? 
7898,"in what moonlight-tangled meshes of perfume, "
7899,"where the clustering keovas guard the squirrel's slumber, "
7900,where the deep woods glimmer with the jasmine's bloom?
7901,"i'll feed thee, o beloved, on milk and wild red honey, "
7902,"i'll bear thee in a basket of rushes, green and white, "
7903,to a palace-bower where golden-vested maidens 
7904,thread with mellow laughter the petals of delight.
7905,"whither dost thou loiter, by what murmuring hollows, "
7906,where oleanders scatter their ambrosial fire? 
7907,"come, thou subtle bride of my mellifluous wooing, "
7908,"come, thou silver-breasted moonbeam of de- sire! "
7909,the song of princess zeb-un-nissa in praise of her own beauty
7910,"when from my cheek i lift my veil, "
7911,"the roses turn with envy pale, "
7912,"and from their pierced hearts, rich with pain, "
7913,send forth their fragrance like a wail. 
7914,or if perchance one perfumed tress 
7915,"be lowered to the wind's caress, "
7916,"the honeyed hyacinths complain, "
7917,and languish in a sweet distress. 
7918,"and, when i pause, still groves among, "
7919,(such loveliness is mine) a throng 
7920,of nightingales awake and strain 
7921,their souls into a quivering song. 
7922,the soul's prayer
7923,in childhood's pride i said to thee: 
7924,"'o thou, who mad'st me of thy breath, "
7925,"speak, master, and reveal to me "
7926,thine inmost laws of life and death. 
7927,'give me to drink each joy and pain 
7928,"which thine eternal hand can mete, "
7929,for my insatiate soul can drain 
7930,"earth's utmost bitter, utmost sweet. "
7931,"'spare me no bliss, no pang of strife, "
7932,"withhold no gift or grief i crave, "
7933,the intricate lore of love and life 
7934,and mystic knowledge of the grave.' 
7935,"lord, thou didst answer stern and low: "
7936,"'child, i will hearken to thy prayer, "
7937,and thy unconquered soul shall know 
7938,all passionate rapture and despair. 
7939,"'thou shalt drink deep of joy and fame, "
7940,"and love shall burn thee like a fire, "
7941,"and pain shall cleanse thee like a flame, "
7942,to purge the dross from thy desire. 
7943,'so shall thy chastened spirit yearn 
7944,"to seek from its blind prayer release, "
7945,"and spent and pardoned, sue to learn "
7946,the simple secret of my peace. 
7947,"i, bending from my sevenfold height, "
7948,"will teach thee of my quickening grace, "
7949,"life is a prism of my light, "
7950,and death the shadow of my face.' 
7951,to a buddha seated on a lotus
7952,"lord buddha, on thy lotus-throne, "
7953,"with praying eyes and hands elate, "
7954,"what mystic rapture dost thou own, "
7955,immutable and ultimate? 
7956,"what peace, unravished of our ken, "
7957,annihilate from the world of men? 
7958,the wind of change for ever blows 
7959,"across the tumult of our way, "
7960,to-morrow's unborn griefs depose 
7961,the sorrows of our yesterday. 
7962,"dream yields to dream, strife follows strife, "
7963,and death unweaves the webs of life.
7964,"for us the travail and the heat, "
7965,"the broken secrets of our pride, "
7966,"the strenuous lessons of defeat, "
7967,"the flower deferred, the fruit denied; "
7968,"but not the peace, supremely won, "
7969,"lord buddha, of thy lotus-throne. "
7970,with futile hands we seek to gain 
7971,"our inaccessible desire, "
7972,"diviner summits to attain, "
7973,with faith that sinks and feet that tire; 
7974,but nought shall conquer or control 
7975,the heavenward hunger of our soul. 
7976,"the end, elusive and afar, "
7977,"still lures us with its beckoning flight, "
7978,and all our mortal moments are 
7979,a session of the infinite. 
7980,"how shall we reach the great, unknown "
7981,nirvana of thy lotus-throne? 
7982,o young through all thy immemorial years! 
7983,"rise, mother, rise, regenerate from thy gloom, "
7984,"and, like a bride high-mated with the spheres, "
7985,beget new glories from thine ageless womb!
7986,the nations that in fettered darkness weep 
7987,crave thee to lead them where great mornings break . . . . 
7988,"mother, o mother, wherefore dost thou sleep? "
7989,arise and answer for thy children's sake! 
7990,thy future calls thee with a manifold sound 
7991,"to crescent honours, splendours, victories vast; "
7992,"waken, o slumbering mother and be crowned, "
7993,who once wert empress of the sovereign past. 
7994,to my children
7995,"golden sun of victory, born "
7996,"in my life's unclouded morn, "
7997,"in my lambent sky of love, "
7998,may your growing glory prove 
7999,"sacred to your consecration, "
8000,to my heart and to my nation. 
8001,"sun of victory, may you be "
8002,sun of song and liberty. 
8003,"lotus-maiden, you who claim "
8004,"all the sweetness of your name, "
8005,"lakshmi, fortune's queen, defend you, "
8006,"lotus-born like you, and send you "
8007,"balmy moons of love to bless you, "
8008,gentle joy-winds to caress you. 
8009,"lotus-maiden, may you be "
8010,fragrant of all ecstasy.
8011,"little lord of battle, hail "
8012,in your newly-tempered mail! 
8013,"learn to conquer, learn to fight "
8014,"in the foremost flanks of right, "
8015,"like valmiki's heroes bold, "
8016,rubies girt in epic gold. 
8017,"lord of battle, may you be, "
8018,lord of love and chivalry.
8019,limpid jewel of delight 
8020,severed from the tender night 
8021,"of your sheltering mother-mine, "
8022,"leap and sparkle, dance and shine, "
8023,blithely and securely set 
8024,in love's magic coronet. 
8025,"living jewel, may you be "
8026,laughter-bound and sorrow-free. 
8027,to my fairy fancies
8028,"nay, no longer i may hold you, "
8029,"in my spirit's soft caresses, "
8030,nor like lotus-leaves enfold you 
8031,in the tangles of my tresses. 
8032,"fairy fancies, fly away "
8033,"to the white cloud-wildernesses, "
8034,"nay, no longer ye may linger "
8035,"with your laughter-lighted faces, "
8036,now i am a thought-worn singer 
8037,in life's high and lonely places. 
8038,"fairy fancies, fly away, "
8039,"to bright wind-inwoven spaces, "
8040,fly away! 
8041,to the god of pain
8042,"unwilling priestess in thy cruel fane, "
8043,"long hast thou held me, pitiless god of pain, "
8044,"bound to thy worship by reluctant vows, "
8045,"my tired breast girt with suffering, and my brows "
8046,anointed with perpetual weariness. 
8047,"long have i borne thy service, through the stress "
8048,"of rigorous years, sad days and slumberless nights, "
8049,performing thine inexorable rites. 
8050,"for thy dark altars, balm nor milk nor rice, "
8051,but mine own soul thou'st ta'en for sacrifice: 
8052,"all the rich honey of my youth's desire, "
8053,"and all the sweet oils from my crushed life drawn, "
8054,and all my flower-like dreams and gem-like fire 
8055,of hopes up-leaping like the light of dawn. 
8056,"i have no more to give, all that was mine "
8057,"is laid, a wrested tribute, at thy shrine; "
8058,"let me depart, for my whole soul is wrung, "
8059,and all my cheerless orisons are sung; 
8060,"let me depart, with faint limbs let me creep "
8061,to some dim shade and sink me down to sleep. 
8062,"o youth, sweet comrade youth, wouldst thou be gone? "
8063,"long have we dwelt together, thou and i; "
8064,"together drunk of many an alien dawn, "
8065,and plucked the fruit of many an alien sky. 
8066,"ah, fickle friend, must i, who yesterday "
8067,"dreamed forwards to long, undimmed ecstasy, "
8068,"henceforward dream, because thou wilt not stay, "
8069,backward to transient pleasure and to thee? 
8070,"i give thee back thy false, ephemeral vow; "
8071,"but, o beloved comrade, ere we part, "
8072,upon my mournful eyelids and my brow 
8073,kiss me who hold thine image in my heart. 
8074,"nay, do not grieve tho' life be full of sadness,"
8075,"dawn will not veil her spleandor for your grief,"
8076,"nor spring deny their bright, appointed beauty"
8077,to lotus blossom and ashoka leaf.
8078,"nay, do not pine, tho' life be dark with trouble,"
8079,time will not pause or tarry on his way;
8080,"to-day that seems so long, so strange, so bitter,"
8081,will soon be some forgotten yesterday.
8082,"nay, do not weep; new hopes, new dreams, new faces,"
8083,"the unspent joy of all the unborn years,"
8084,"will prove your heart a traitor to its sorrow,"
8085,and make your eyes unfaithful to their tears. 
8086,"honey, child, honey, child, whither are you going? "
8087,would you cast your jewels all to the breezes blowing? 
8088,would you leave the mother who on golden grain has fed you? 
8089,would you grieve the lover who is riding forth to wed you?
8090,"mother mine, to the wild forest i am going, "
8091,where upon the champa boughs the champa buds are blowing; 
8092,"to the köil-haunted river-isles where lotus lilies glisten, "
8093,the voices of the fairy folk are calling me: o listen!
8094,"honey, child, honey, child, the world is full of pleasure, "
8095,of bridal-songs and cradle-songs and sandal-scented leisure. 
8096,"your bridal robes are in the loom, silver and saffron glowing, "
8097,your bridal cakes are on the hearth: o whither are you going?
8098,"the bridal-songs and cradle-songs have cadences of sorrow, "
8099,"the laughter of the sun to-day, the wind of death to-morrow. "
8100,far sweeter sound the forest-notes where forest-streams are falling; 
8101,"o mother mine, i cannot stay, the fairy-folk are calling. "
8102,"anger fills my heart and soul anger fills my heart and soul anger takes a mighty toll anger lessens but can never leave anger you hope to never receive, anger stays forever within anger acts with the might of all sin anger is deadly to all around anger gets mad at the thought of sound anger is the thoughts in my head anger that’s mine all should dread anger for me is different from you anger you see tells me what to do anger will sit and whisper in my ear anger he sits and tells me all that you fear, anger… he is here he’s here to stay anger is the hole in which we lay anger is and anger will always be with us he is in me, and he is in you he can make you do what he wants you to anger will make you make you cry anger can make you want to die anger can make you go insane anger….. ... a blood filled rain no more anger no more….. walk to the bright light  shinning through that door…not knowing what’s in store but even then anger lives on but you… nevermore "
8103,anger anger is anger anger makes you scream anger makes you hate anger takes control anger want let go anger wants you to hurt anger wants you to sufer anger makes you mad anger makes you cry anger turns people against you anger is anger 
8104,anger anger is anger anger makes you scream anger makes you hate anger takes control anger want let go anger wants you to hurt anger wants you to sufer anger makes you mad anger makes you cry anger turns people against you anger is anger 
8105,anger anger is anger anger makes you scream anger makes you hate anger takes control anger want let go anger wants you to hurt anger wants you to suffer anger makes you mad anger makes you cry anger turns people against you anger is anger 
8106,this ill temper i have is making me mad
8107,i blow up and i don’t know why
8108,i wish for just a moment i could handle my anger right
8109,i wish for just a moment i could love you right
8110,i wish my attitude would just go away
8111,i wish my anger would stay at bay
8112,this outlook i have on life needs to change
8113,this outlook i have you needs to say the same
8114,i love you deep down inside
8115,i wish you would see
8116,that you’re the only princess for me
8117,the anger i have deep in side
8118,comes out when i least expect it
8119,this anger i have in me should just go away
8120,this anger i have is an annoyance
8121,this anger i have has messed my life up
8122,this anger i have is stupid
8123,anger you have messed up my love for you
8124,anger you have messed up my life
8125,anger you have destroyed who i am inside and out
8126,anger you are the devil
8127,anger you are all that is bad
8128,this anger i have in me has made me fight
8129,a fight that was not worth it
8130,anger you made me hit the wrong person
8131,anger you made me do the wrong things
8132,anger you are the feeling that i would never miss
8133,anger you have caused me so much sorrow
8134,anger you have caused nothing but grief.
8135,anger just go away 
8136,anger my friend/enemy 
8137,anger is a form of fear
8138,anger is what i’m waiting to hear
8139,anger is deep down inside me
8140,anger drives me crazy
8141,anger is what turns me on
8142,anger is what turns me off
8143,anger is my enemy
8144,anger is my pal
8145,anger is gonna kill me
8146,anger is gonna save me
8147,anger might just help me 
8148,find my true love.............
8149,..........................mayb e?   
8150,anger and me 
8151,anger is a form of fear
8152,anger is what i’m waiting to hear
8153,anger is deep down inside me
8154,anger drives me crazy
8155,anger is what turns me on
8156,anger is what turns me off
8157,anger is my enemy
8158,anger is my pal
8159,anger is gonna kill me
8160,anger is gonna save me
8161,anger might just help me 
8162,find my true love.............
8163,..........................mayb e? 
8164,anger is evil 
8165,"anger is evil, "
8166,"anger is bad, "
8167,anger is when i'm mad.
8168,anger makes me scream and shout.
8169,anger makes me lose control.
8170,anger turns people against me.
8171,anger makes me suffer...
8172,again anger is evil!
8173,plenty of anger
8174,there is plenty of anger inside of me
8175,it has to stop
8176,why is there so much anger inside of me? 
8177,my anger is part of my frustration
8178,i have to control it now
8179,my anger causes me plenty of trouble
8180,there is plenty of anger inside of me
8181,and what is anger do i know? 
8182,anger is a strong feeling of displasure
8183,it is a grief that i have inside of me
8184,how can i control it? 
8185,what triggers my anger? 
8186,can i recognize it?
8187,anger is a force that can never die
8188,anger is a force that lies deep within us
8189,anger is the force that can change a man life 
8190,anger is the force that can create a kill
8191,anger is the force that can ruin your life
8192,anger is the thing we all fear
8193,anger is the force that will kill us all
8194,anger is the force that we shall take to are grave
8195,the new fake me
8196,the blade is cold
8197,but not old
8198,i didn’t go deep
8199,i didn’t even weep
8200,just one cut is all i need
8201,"and my mind goes calm, while my cut bleeds"
8202,it was harmless but helped so much
8203,i stopped being mad and such
8204,no more angry thoughts went through my mind
8205,"just fascination, everything else left behind"
8206,is the start or the end?
8207,all i know is i don’t want to disappoint my friend
8208,is it too late for me?
8209,i thought i was getting better but i only pretended to be
8210,the cut now stains my arm
8211,"nothing big or deep, nothing to cause much harm"
8212,a cat scratch is what i’ll say
8213,but i doubt people will see any day
8214,they won’t see the real me and who i am
8215,they won’t see my body is disconnected from my brain stem
8216,"i don’t want attention, i don’t deserve it"
8217,"i play along with the world, but my candle is not lit"
8218,i’m a lost soul on this land
8219,"my minds drifting, my body sinking in sand"
8220,i’ve given up on people
8221,it’s now me alone in my own steeple
8222,i get so mad so quick
8223,"like a switch on the wall, tense with every click"
8224,maybe i’m only meant to be there for others
8225,don’t the daughters learn from the mothers?
8226,only my mother does not know me
8227,she only sees who she wants to see
8228,there’s no way her sweet child
8229,cut her arm to keep her mind from going wild
8230,do they realize their actions affect me so?
8231,that sometimes they cause me to hit my low?
8232,"no they don’t, all they see is him"
8233,they can’t even see the pattern; my cups reached its brim.
8234,he angers then he lies
8235,to get people to take him back. i bet he even denies
8236,the wrongs that he’s done
8237,all because he thinks life is fun
8238,but when will he see
8239,that he’s just another wanna be
8240,it’s possible i just don’t belong
8241,there are parts of me i’ve discovered are gone
8242,like my patience to wait
8243,i’m done waiting there’s nothing to debate
8244,once i’m of age you’ll barely see me
8245,once i get a car i’ll never be here to be
8246,i witness to the yells or shouts
8247,a witness to the pattern of oh okay and get out
8248,a witness to tears and uproars
8249,a witness to hurtful words and slamming doors
8250,a witness to a father who’s confused
8251,because my mother is either okay or blowing a fuse
8252,i’ll stop being the victim of being on the edge
8253,"because i’ll stop being around, i won’t be on the ledge"
8254,i won’t be the victim of feeling guilty anymore
8255,i won’t be the victim or witness anytime i walk out that door
8256,am i lost? that’s easy to say
8257,is there hope? we’ll see with each coming day.
8258,my name does not matter all that matters is the story my friend
8259,"the one with a strong beginning, unclear middle, but no end."
8260,it’s a screwed up world even a blind man could see
8261,that to fake happiness you have to be who others expect you to be
8262,i don't understand
8263,how are you daddy?
8264,it's been forever since we've spoken.
8265,"i guess we let this whole time pass,"
8266,and now we're completely broken.
8267,do you miss me the way i wish you would?
8268,i can't imagine you do.
8269,"you've never sent cards or letters,"
8270,even though i'm missing you.
8271,"my past attempts seem to mean nothing,"
8272,it's nice to know you care.
8273,"and even though you don't know how,"
8274,i've always wished you were there.
8275,"so, how are you daddy?"
8276,it's been a while.
8277,i miss your laugh
8278,and i've forgotten your smile.
8279,"i'm not even gonna ask,"
8280,if you've ever missed me.
8281,through the unanswered phone calls and the time that's passed
8282,the answers i can see.
8283,"it's funny how fast the time goes,"
8284,but six years have come and gone.
8285,"maybe you thought i didn't need you,"
8286,but you were oh so wrong.
8287,how are you daddy?
8288,i hope you're doing well.
8289,"i'm learning how to deal with the pain,"
8290,i think you can probably tell.
8291,"don't ever try to make things right,"
8292,they'll never be the same.
8293,"in fact if it makes you feel any better,"
8294,you can just forget my name.
8295,"to you i doubt i even exist,"
8296,i don't have a place in your world.
8297,"i hope you're doing well daddy, "
8298,"love, your little girl"
8299,please make the yelling stop 
8300,no matter how well i do in school or how well i clean the house
8301,still they aren't happy
8302,from the time i walk in the door till the time i go to bed every night 
8303,the screaming never seems to stop
8304,it used to be just from my mother
8305,but now my father too 
8306,sometimes even my older brother
8307,the one i considered my hero
8308,"they tell me i'm crazy, stupid, a mess up"
8309,i just want to be good enough for them 
8310,but it seems i never will be
8311,they say they care and they say they love me
8312,"but i'm not blind, i can see the hate they have for me"
8313,"i was a mistake, they didn't believe in abortion"
8314,"so, here i am, the mistake child"
8315,in the dark i sit in my room and cry
8316,day in and day out
8317,their words and looks 
8318,slice into me deeper than any razor ever could
8319,"this has went on for years now, "
