,TEXT
1657,then the whole night through i flung them one by one into the street.
1658,in the morning travellers came; they picked them up and carried them into far countries.
1659,"poems on time the butterfly counts not months but moments, and has time enough. "
1660,"time is a wealth of change, but the clock in its parody makes it mere change and no wealth."
1661,let your life lightly dance on the edges of time like dew on the tip of a leaf. 
1662,poems on beauty
1663,beauty is truth's smile when she beholds her own face in a perfect mirror.
1664,beauty is in the ideal of perfect harmony which is in the universal being; truth the perfect comprehension of the universal mind.
1665,a love song from the north
1666,"tell me no more of thy love, papeeha, wouldst thou recall to my heart, papeeha, dreams of delight that are gone, when swift to my side came the feet of my lover with stars of the dusk and the dawn? i see the soft wings of the clouds on the river, and jewelled with raindrops the mango-leaves quiver, and tender boughs flower on the plain..... but what is their beauty to me, papeeha, beauty of blossom and shower, papeeha, that brings not my lover again?  tell me no more of thy love, papeeha, wouldst thou revive in my heart, papeeha grief for the joy that is gone? i hear the bright peacock in glimmering woodlands cry to its mate in the dawn; i hear the black koel's slow, tremulous wooing, and sweet in the gardens the calling and cooing of passionate bulbul and dove.... but what is their music to me, papeeha songs of their laughter and love, papeeha, to me, forsaken of love? "
1667,alabaster
1668,"like this alabaster box whose art  is frail as a cassia-flower, is my heart,  carven with delicate dreams and wrought  with many a subtle and exquisite thought."
1669," therein i treasure the spice and scent  of rich and passionate memories blent  like odours of cinnamon, sandal and clove,  of song and sorrow and life and love. "
1670, an indian love song
1671,he
1672,"lift up the veils that darken the delicate moon  of thy glory and grace, withhold not, o love, from the night  of my longing the joy of thy luminous face, give me a spear of the scented keora  guarding thy pinioned curls,  or a silken thread from the fringes  that trouble the dream of thy glimmering pearls; faint grows my soul with thy tresses' perfume  and the song of thy anklets' caprice, revive me, i pray, with the magical nectar  that dwells in the flower of thy kiss."
1673,she 
1674,"how shall i yield to the voice of thy pleading,  how shall i grant thy prayer, or give thee a rose-red silken tassel,  a scented leaf from my hair? or fling in the flame of thy heart's desire the veils that cover my face, profane the law of my father's creed for a foe  of my father's race? thy kinsmen have broken our sacred altars and slaughtered our sacred kine, the feud of old faiths and the blood of old battles sever thy people and mine."
1675,he
1676,"what are the sins of my race, beloved,  what are my people to thee?  and what are thy shrines, and kine and kindred,  what are thy gods to me? love recks not of feuds and bitter follies,  of stranger, comrade or kin, alike in his ear sound the temple bells  and the cry of the muezzin. for love shall cancel the ancient wrong  and conquer the ancient rage, redeem with his tears the memoried sorrow  that sullied a bygone age.  "
1677,autumn song
1678,"like a joy on the heart of a sorrow,    the sunset hangs on a cloud; a golden storm of glittering sheaves, of fair and frail and fluttering leaves,    the wild wind blows in a cloud."
1679,"hark to a voice that is calling    to my heart in the voice of the wind: my heart is weary and sad and alone, for its dreams like the fluttering leaves have gone,    and why should i stay behind?  "
1680, corn grinders
1681,"o little mouse, why dost thou cry  while merry stars laugh in the sky? "
1682," alas! alas! my lord is dead!  ah, who will ease my bitter pain?  he went to seek a millet-grain  in the rich farmer's granary shed;  they caught him in a baited snare,  and slew my lover unaware:  alas! alas! my lord is dead."
1683," o little deer, why dost thou moan,  hid in thy forest-bower alone?"
1684, alas! alas! my lord is dead!  ah! who will quiet my lament?
1685," at fall of eventide he went  to drink beside the river-head;  a waiting hunter threw his dart,  and struck my lover through the heart.  alas! alas! my lord is dead."
1686," o little bride, why dost thou weep  with all the happy world asleep? "
1687," alas! alas! my lord is dead!  ah, who will stay these hungry tears,  or still the want of famished years,  and crown with love my marriage-bed?  my soul burns with the quenchless fire  that lit my lover's funeral pyre:  alas! alas! my lord is dead. "
1688,coromandel fishers
1689,"rise, brothers, rise; the wakening skies pray to the morning light,  the wind lies asleep in the arms of the dawn like a child that has cried all night.  come, let us gather our nets from the shore and set our catamarans free,  to capture the leaping wealth of the tide, for we are the kings of the sea! "
1690,"no longer delay, let us hasten away in the track of the sea gull's call,  the sea is our mother, the cloud is our brother, the waves are our comrades all.  what though we toss at the fall of the sun where the hand of the sea-god drives?  he who holds the storm by the hair, will hide in his breast our lives. "
1691,"sweet is the shade of the cocoanut glade, and the scent of the mango grove, and sweet are the sands at the full o' the moon with the sound of the voices we love;  but sweeter, o brothers, the kiss of the spray and the dance of the wild foam's glee;  row, brothers, row to the edge of the verge, where the low sky mates with the sea.  "
1692, cradle song
1693,"from groves of spice,  o'er fields of rice,  athwart the lotus-stream,  i bring for you,  aglint with dew  a little lovely dream. "
1694," sweet, shut your eyes,  the wild fire-fiies  dance through the fairy neem;  from the poppy-bole  for you i stole  a little lovely dream."
1695," dear eyes, good-night,  in golden light  the stars around you gleam;  on you i press  with soft caress  a little lovely dream. "
1696,damayante to nala in the hour of exile
1697,"shalt thou be conquered of a human fate  my liege, my lover, whose imperial head  hath never bent in sorrow of defeat?  shalt thou be vanquished, whose imperial feet  have shattered armies and stamped empires dead?  who shall unking thee, husband of a queen?  wear thou thy majesty inviolate.  earth's glories flee of human eyes unseen,  earth's kingdoms fade to a remembered dream,  but thine henceforth shall be a power supreme, "
1698," dazzling command and rich dominion,  the winds thy heralds and thy vassals all  the silver-belted planets and the sun.  where'er the radiance of thy coming fall,  shall dawn for thee her saffron footcloths spread,  sunset her purple canopies and red,  in serried splendour, and the night unfold  her velvet darkness wrought with starry gold  for kingly raiment, soft as cygnet-down.  my hair shall braid thy temples like a crown  of sapphires, and my kiss upon thy brows  like çithar-music lull thee to repose,  till the sun yield thee homage of his light. "
1699," o king, thy kingdom who from thee can wrest?  what fate shall dare uncrown thee from this breast,  o god-born lover, whom my love doth gird  and armour with impregnable delight  of hope's triumphant keen flame-carven sword? "
1700,ecstasy
1701,"cover mine eyes, o my love!  mine eyes that are weary of bliss  as of light that is poignant and strong  o silence my lips with a kiss,  my lips that are weary of song!  shelter my soul, o my love!  my soul is bent low with the pain  and the burden of love, like the grace  of a flower that is smitten with rain:  o shelter my soul from thy face! "
1702,harvest hymn
1703,mens voices:
1704,"lord of the lotus, lord of the harvest,  bright and munificent lord of the morn!  thine is the bounty that prospered our sowing,  thine is the bounty that nurtured our corn.  we bring thee our songs and our garlands for tribute,  the gold of our fields and the gold of our fruit;  o giver of mellowing radiance, we hail thee,  we praise thee, o surya, with cymbal and flute."
1705,"lord of the rainbow, lord of the harvest,  great and beneficent lord of the main!  thine is the mercy that cherished our furrows, "
1706,"thine is the mercy that fostered our grain.  we bring thee our thanks and our garlands for tribute,  the wealth of our valleys, new-garnered and ripe;  o sender of rain and the dewfall, we hail thee,  we praise thee, varuna, with cymbal and pipe. "
1707,womens voices:
1708,"queen of the gourd-flower, queen of the har- vest,  sweet and omnipotent mother, o earth!  thine is the plentiful bosom that feeds us,  thine is the womb where our riches have birth.  we bring thee our love and our garlands for tribute,  with gifts of thy opulent giving we come;  o source of our manifold gladness, we hail thee,  we praise thee, o prithvi, with cymbal and drum."
1709,all voices: 
1710,"lord of the universe, lord of our being,  father eternal, ineffable om!  thou art the seed and the scythe of our harvests,  thou art our hands and our heart and our home.  we bring thee our lives and our labours for tribute,  grant us thy succour, thy counsel, thy care.  o life of all life and all blessing, we hail thee,  we praise thee, o bramha, with cymbal and prayer "
1711,humayun to zobeida (from the urdu)
1712,"you flaunt your beauty in the rose, your glory in the dawn,  your sweetness in the nightingale, your white- ness in the swan."
1713,"you haunt my waking like a dream, my slumber like a moon,  pervade me like a musky scent, possess me like a tune. "
1714,"yet, when i crave of you, my sweet, one tender moment's grace,  you cry, ""i sit behind the veil, i cannot show my face."""
1715,shall any foolish veil divide my longing from my bliss?  shall any fragile curtain hide your beauty from my kiss?
1716,"what war is this of thee and me? give o'er the wanton strife,  you are the heart within my heart, the life within my life. "
1717,in praise of henna
1718,"a kokila called from a henna-spray:  lira! liree! lira! liree!  hasten, maidens, hasten away  to gather the leaves of the henna-tree.  send your pitchers afloat on the tide,  gather the leaves ere the dawn be old,  grind them in mortars of amber and gold,  the fresh green leaves of the henna-tree."
1719," a kokila called from a henna-spray:  lira! liree! lira! liree!  hasten maidens, hasten away  to gather the leaves of the henna-tree.  the tilka's red for the brow of a bride,  and betel-nut's red for lips that are sweet;  but, for lily-like fingers and feet,  the red, the red of the henna-tree.  "
1720,in salutation to the eternal peace
1721,"men say the world is full of fear and hate, and all life's ripening harvest-fields await the restless sickle of relentless fate."
1722,"but i, sweet soul, rejoice that i was born, when from the climbing terraces of corn i watch the golden orioles of thy morn."
1723,"what care i for the world's desire and pride, who know the silver wings that gleam and glide, the homing pigeons of thine eventide?"
1724,"what care i for the world's loud weariness, who dream in twilight granaries thou dost bless with delicate sheaves of mellow silences?"
1725,"say, shall i heed dull presages of doom, or dread the rumoured loneliness and gloom, the mute and mythic terror of the tomb?"
1726,"for my glad heart is drunk and drenched with thee, o inmost wind of living ecstasy! o intimate essence of eternity! "
1727,in the bazaars of hyderabad
1728,"what do you sell o ye merchants ? richly your wares are displayed. turbans of crimson and silver, tunics of purple brocade, mirrors with panels of amber, daggers with handles of jade."
1729,"what do you weigh, o ye vendors? saffron and lentil and rice. what do you grind, o ye maidens? sandalwood, henna, and spice. what do you call , o ye pedlars? chessmen and ivory dice."
1730,"what do you make,o ye goldsmiths? wristlet and anklet and ring, bells for the feet of blue pigeons frail as a dragon-fly’s wing, girdles of gold for dancers, scabbards of gold for the king."
1731,"what do you cry,o ye fruitmen? citron, pomegranate, and plum. what do you play ,o musicians? cithar, sarangi and drum. what do you chant, o magicians? spells for aeons to come."
1732,"what do you weave, o ye flower-girls with tassels of azure and red? crowns for the brow of a bridegroom, chaplets to garland his bed. sheets of white blossoms new-garnered to perfume the sleep of the dead.  "
1733,in the forest
1734,"here, o my heart, let us burn the dear dreams that are dead,  here in this wood let us fashion a funeral pyre  of fallen white petals and leaves that are mellow and red,  here let us burn them in noon's flaming torches of fire. "
1735," we are weary, my heart, we are weary, so long we have borne  the heavy loved burden of dreams that are dead, let us rest,  let us scatter their ashes away, for a while let us mourn;  we will rest, o my heart, till the shadows are gray in the west. "
1736,"but soon we must rise, o my heart, we must wander again  into the war of the world and the strife of the throng;  let us rise, o my heart, let us gather the dreams that remain,  we will conquer the sorrow of life with the sorrow of song. "
1737,indian dancer
1738,"eyes ravished with rapture, celestially panting, what passionate bosoms aflaming with fire  drink deep of the hush of the hyacinth heavens that glimmer around them in fountains of light;  o wild and entrancing the strain of keen music that cleaveth the stars like a wail of desire,  and beautiful dancers with houri-like faces bewitch the voluptuous watches of night."
1739," the scents of red roses and sandalwood flutter and die in the maze of their gem-tangled hair,  and smiles are entwining like magical serpents the poppies of lips that are opiate-sweet;  their glittering garments of purple are burning like tremulous dawns in the quivering air,  and exquisite, subtle and slow are the tinkle and tread of their rhythmical, slumber-soft feet."
1740," now silent, now singing and swaying and swinging, like blossoms that bend to the breezes or showers,  now wantonly winding, they flash, now they falter, and, lingering, languish in radiant choir;  their jewel-girt arms and warm, wavering, lily-long fingers enchant through melodious hours,  eyes ravished with rapture, celestially panting, what passionate bosoms aflaming with fire! "
1741,indian love song
1742,she
1743,"like a serpent to the calling voice of flutes,  glides my heart into thy fingers, o my love!  where the night-wind, like a lover, leans above  his jasmine-gardens and sirisha-bowers;  and on ripe boughs of many-coloured fruits  bright parrots cluster like vermilion flowers. "
1744, he
1745,"like the perfume in the petals of a rose,  hides thy heart within my bosom, o my love!  like a garland, like a jewel, like a dove  that hangs its nest in the asoka-tree.  lie still, o love, until the morning sows  her tents of gold on fields of ivory. "
1746,indian weavers
1747,"weavers, weaving at break of day,  why do you weave a garment so gay? . . .  blue as the wing of a halcyon wild,  we weave the robes of a new-born child."
1748," weavers, weaving at fall of night,  why do you weave a garment so bright? . . .  like the plumes of a peacock, purple and green,  we weave the marriage-veils of a queen."
1749," weavers, weaving solemn and still,  what do you weave in the moonlight chill? . . .  white as a feather and white as a cloud,  we weave a dead man's funeral shroud.  "
1750,leili
1751,"the serpents are asleep among the poppies,  the fireflies light the soundless panther's way  to tangled paths where shy gazelles are straying,  and parrot-plumes outshine the dying day.  o soft! the lotus-buds upon the stream  are stirring like sweet maidens when they dream. "
1752," a caste-mark on the azure brows of heaven,  the golden moon burns sacred, solemn, bright  the winds are dancing in the forest-temple,  and swooning at the holy feet of night.  hush! in the silence mystic voices sing  and make the gods their incense-offering. "
1753,life
1754,"children, ye have not lived, to you it seems  life is a lovely stalactite of dreams,  or carnival of careless joys that leap  about your hearts like billows on the deep  in flames of amber and of amethyst. "
1755," children, ye have not lived, ye but exist  till some resistless hour shall rise and move  your hearts to wake and hunger after love,  and thirst with passionate longing for the things  that burn your brows with blood-red sufferings. "
1756," till ye have battled with great grief and fears,  and borne the conflict of dream-shattering years,  wounded with fierce desire and worn with strife,  children, ye have not lived: for this is life.  "
1757,my dead dream
1758,"have you found me, at last, o my dream? seven eons ago  you died and i buried you deep under forests of snow.  why have you come hither? who bade you awake from your sleep  and track me beyond the cerulean foam of the deep? "
1759," would you tear from my lintels these sacred green garlands of leaves?  would you scare the white, nested, wild pigeons of joy from my eaves?  would you touch and defile with dead fingers the robes of my priest?  would you weave your dim moan with the chantings of love at my feast? "
1760,"go back to your grave, o my dream, under forests of snow,  where a heart-riven child hid you once, seven eons ago.  who bade you arise from your darkness? i bid you depart!  profane not the shrines i have raised in the clefts of my heart. "
1761,nightfall in the city of hyderabad
1762,"see how the speckled sky burns like a pigeon's throat,  jewelled with embers of opal and peridote. "
1763," see the white river that flashes and scintillates,  curved like a tusk from the mouth of the city-gates. "
1764," hark, from the minaret, how the muezzin's call  floats like a battle-flag over the city wall. "
1765," from trellised balconies, languid and luminous  faces gleam, veiled in a splendour voluminous. "
1766," leisurely elephants wind through the winding lanes,  swinging their silver bells hung from their silver chains. "
1767, round the high char minar sounds of gay cavalcades  blend with the music of cymbals and serenades. 
1768," over the city bridge night comes majestical,  borne like a queen to a sumptuous festival.  "
1769,ode to h.h. the nizam of hyderabad
1770,"deign, prince, my tribute to receive,  this lyric offering to your name,  who round your jewelled scepter bind  the lilies of a poet's fame;  beneath whose sway concordant dwell  the peoples whom your laws embrace,  in brotherhood of diverse creeds,  and harmony of diverse race:"
1771,"the votaries of the prophet's faith,  of whom you are the crown and chief  and they, who bear on vedic brows  their mystic symbols of belief;  and they, who worshipping the sun,  fled o'er the old iranian sea;  and they, who bow to him who trod  the midnight waves of galilee."
1772,"sweet, sumptuous fables of baghdad  the splendours of your court recall,  the torches of a thousand nights  blaze through a single festival;  and saki-singers down the streets,  pour for us, in a stream divine,  from goblets of your love-ghazals  the rapture of your sufi wine."
1773," prince, where your radiant cities smile,  grim hills their sombre vigils keep,  your ancient forests hoard and hold  the legends of their centuried sleep;  your birds of peace white-pinioned float  o'er ruined fort and storied plain,  your faithful stewards sleepless guard  the harvests of your gold and grain."
1774,"god give you joy, god give you grace  to shield the truth and smite the wrong,  to honour virtue, valour, worth.  to cherish faith and foster song.  so may the lustre of your days  outshine the deeds firdusi sung,  your name within a nation's prayer,  your music on a nation's tongue.  "
1775,palanquin bearers
1776,"lightly, o lightly we bear her along, she sways like a flower in the wind of our song; she skims like a bird on the foam of a stream, she floats like a laugh from the lips of a dream. gaily, o gaily we glide and we sing, we bear her along like a pearl on a string."
1777,"softly, o softly we bear her along, she hangs like a star in the dew of our song; she springs like a beam on the brow of the tide, she falls like a tear from the eyes of a bride. lightly, o lightly we glide and we sing, we bear her along like a pearl on a string. "
1778,past and future
1779,"the new hath come and now the old retires:  and so the past becomes a mountain-cell,  where lone, apart, old hermit-memories dwell  in consecrated calm, forgotten yet  of the keen heart that hastens to forget  old longings in fulfilling new desires. "
1780," and now the soul stands in a vague, intense  expectancy and anguish of suspense,  on the dim chamber-threshold . . . lo! he sees  like a strange, fated bride as yet unknown,  his timid future shrinking there alone,  beneath her marriage-veil of mysteries. "
1781,song of a dream
1782,"once in the dream of a night i stood  lone in the light of a magical wood,  soul-deep in visions that poppy-like sprang;  and spirits of truth were the birds that sang,  and spirits of love were the stars that glowed,  and spirits of peace were the streams that flowed  in that magical wood in the land of sleep."
1783," lone in the light of that magical grove,  i felt the stars of the spirits of love  gather and gleam round my delicate youth,  and i heard the song of the spirits of truth;  to quench my longing i bent me low  by the streams of the spirits of peace that flow  in that magical wood in the land of sleep.  "
1784,street cries
1785,"when dawn's first cymbals beat upon the sky,  rousing the world to labour's various cry,  to tend the flock, to bind the mellowing grain,  from ardent toil to forge a little gain,  and fasting men go forth on hurrying feet,  buy bread, buy bread, rings down the eager street. "
1786," when the earth falters and the waters swoon  with the implacable radiance of noon,  and in dim shelters koïls hush their notes,  and the faint, thirsting blood in languid throats  craves liquid succour from the cruel heat,  buy fruit, buy fruit, steals down the panting street."
1787," when twilight twinkling o'er the gay bazaars,  unfurls a sudden canopy of stars,  when lutes are strung and fragrant torches lit  on white roof-terraces where lovers sit  drinking together of life's poignant sweet,  buy flowers, buy flowers, floats down the singing street.  "
1788,suttee
1789,"lamp of my life, the lips of death  hath blown thee out with their sudden breath;  naught shall revive thy vanished spark . . .  love, must i dwell in the living dark? "
1790," tree of my life, death's cruel foot  hath crushed thee down to thy hidden root;  nought shall restore thy glory fled . . .  shall the blossom live when the tree is dead? "
1791," life of my life, death's bitter sword  hath severed us like a broken word,  rent us in twain who are but one . .  shall the flesh survive when the soul is gone? "
1792,the bangle sellers
1793,"bangle sellers are we who bear our shining loads to the temple fair... who will buy these delicate, bright rainbow-tinted circles of light? lustrous tokens of radiant lives, for happy daughters and happy wives."
1794,"some are meet for a maiden's wrist, silver and blue as the mountain mist, some are flushed like the buds that dream on the tranquil brow of a woodland stream, some are aglow wth the bloom that cleaves to the limpid glory of new born leaves"
1795,"some are like fields of sunlit corn, meet for a bride on her bridal morn, some, like the flame of her marriage fire, or, rich with the hue of her heart's desire, tinkling, luminous, tender, and clear, like her bridal laughter and bridal tear."
1796,"some are purple and gold flecked grey for she who has journeyed through life midway, whose hands have cherished, whose love has blest, and cradled fair sons on her faithful breast, and serves her household in fruitful pride, and worships the gods at her husband's side.  "
1797,the coromandel fishers
1798,"rise, brothers, rise; the wakening skies pray to the morning light,  the wind lies asleep in the arms of the dawn like a child that has cried all night.  come, let us gather our nets from the shore and set our catamarans free,  to capture the leaping wealth of the tide, for we are the kings of the sea! "
1799,"no longer delay, let us hasten away in the track of the sea gull's call,  the sea is our mother, the cloud is our brother, the waves are our comrades all.  what though we toss at the fall of the sun where the hand of the sea-god drives?  he who holds the storm by the hair, will hide in his breast our lives. "
1800,"sweet is the shade of the cocoanut glade, and the scent of the mango grove, and sweet are the sands at the full o' the moon with the sound of the voices we love;  but sweeter, o brothers, the kiss of the spray and the dance of the wild foam's glee;  row, brothers, row to the edge of the verge, where the low sky mates with the sea. "
1801,the illusion of love
1802,"beloved, you may be as all men say only a transient spark of flickering flame set in loam of clay –  i care not …since you kindle all my dark with the immortal lustres of the day."
1803,"and as all men deem, dearest, you may be only a common shell chance-winnowed by the sea-winds from the sea – the subtle murmurs of eternity."
1804,"and tho’ you are, like men or mortal race, only a hapless thing that death may mar and destiny efface –  i care not … since unto my heart you bring the very vision of god’s dwelling-place. "
1805,the indian gipsy
